04-Feb-26 16:52:47 - Created loss log file ./logs/loss_log_20260204165247_.npy.npz
04-Feb-26 16:52:47 - Number of parquet files: 4741
04-Feb-26 16:52:47 - Train files: 3792
04-Feb-26 16:52:47 - Validation files: 949
04-Feb-26 16:52:47 - Loading training data...
04-Feb-26 16:52:47 - PyTorch version 2.5.1 available.
04-Feb-26 16:52:47 - TensorFlow version 2.18.0 available.
04-Feb-26 16:52:53 - Training samples: 21424800
04-Feb-26 16:52:53 - Loading validation data...
04-Feb-26 16:52:54 - Validation samples: 5361850
04-Feb-26 16:52:54 - Total training steps per epoch (estimated): 334762
04-Feb-26 16:52:55 - Running without torch.compile (more stable for training).
04-Feb-26 16:52:55 - Training model...
04-Feb-26 16:53:00 - Features shape: torch.Size([64, 4])
04-Feb-26 16:53:00 - Elevation shape: torch.Size([64, 750])
04-Feb-26 16:53:00 - Targets shape: torch.Size([64])
04-Feb-26 16:53:00 - Mask shape: torch.Size([64, 750])
04-Feb-26 16:53:00 - Preds shape: torch.Size([64])
04-Feb-26 16:53:46 - [Epoch=1 | Step=100/334762] loss=216.4362
04-Feb-26 16:54:43 - [Epoch=1 | Step=200/334762] loss=214.3948
04-Feb-26 16:55:41 - [Epoch=1 | Step=300/334762] loss=216.2299
04-Feb-26 16:56:40 - [Epoch=1 | Step=400/334762] loss=215.7494
04-Feb-26 16:57:38 - [Epoch=1 | Step=500/334762] loss=212.8723
04-Feb-26 16:58:36 - [Epoch=1 | Step=600/334762] loss=194.0421
04-Feb-26 16:59:35 - [Epoch=1 | Step=700/334762] loss=214.8168
04-Feb-26 17:00:33 - [Epoch=1 | Step=800/334762] loss=194.2778
04-Feb-26 17:01:32 - [Epoch=1 | Step=900/334762] loss=185.1829
04-Feb-26 17:02:32 - [Epoch=1 | Step=1000/334762] loss=198.3635
04-Feb-26 17:03:32 - [Epoch=1 | Step=1100/334762] loss=194.5804
04-Feb-26 17:04:32 - [Epoch=1 | Step=1200/334762] loss=183.9173
04-Feb-26 17:05:36 - [Epoch=1 | Step=1300/334762] loss=178.9351
04-Feb-26 17:06:45 - [Epoch=1 | Step=1400/334762] loss=179.2435
04-Feb-26 17:07:53 - [Epoch=1 | Step=1500/334762] loss=171.4548
04-Feb-26 17:09:03 - [Epoch=1 | Step=1600/334762] loss=169.0610
04-Feb-26 17:10:09 - [Epoch=1 | Step=1700/334762] loss=159.3961
04-Feb-26 17:11:17 - [Epoch=1 | Step=1800/334762] loss=185.7065
04-Feb-26 17:12:26 - [Epoch=1 | Step=1900/334762] loss=165.9810
04-Feb-26 17:13:39 - [Epoch=1 | Step=2000/334762] loss=172.3691
04-Feb-26 17:14:47 - [Epoch=1 | Step=2100/334762] loss=167.9926
04-Feb-26 17:15:54 - [Epoch=1 | Step=2200/334762] loss=163.0798
04-Feb-26 17:16:59 - [Epoch=1 | Step=2300/334762] loss=173.4228
04-Feb-26 17:18:06 - [Epoch=1 | Step=2400/334762] loss=166.1853
04-Feb-26 17:19:12 - [Epoch=1 | Step=2500/334762] loss=165.8084
04-Feb-26 17:20:18 - [Epoch=1 | Step=2600/334762] loss=162.7823
04-Feb-26 17:21:27 - [Epoch=1 | Step=2700/334762] loss=160.4522
04-Feb-26 17:22:34 - [Epoch=1 | Step=2800/334762] loss=157.9200
04-Feb-26 17:23:43 - [Epoch=1 | Step=2900/334762] loss=147.9027
04-Feb-26 17:24:49 - [Epoch=1 | Step=3000/334762] loss=144.4489
04-Feb-26 17:25:55 - [Epoch=1 | Step=3100/334762] loss=144.4940
04-Feb-26 17:26:59 - [Epoch=1 | Step=3200/334762] loss=137.3535
04-Feb-26 17:28:06 - [Epoch=1 | Step=3300/334762] loss=134.0941
04-Feb-26 17:29:07 - [Epoch=1 | Step=3400/334762] loss=134.6724
04-Feb-26 17:30:10 - [Epoch=1 | Step=3500/334762] loss=134.0087
04-Feb-26 17:31:17 - [Epoch=1 | Step=3600/334762] loss=128.2816
04-Feb-26 17:32:24 - [Epoch=1 | Step=3700/334762] loss=118.4843
04-Feb-26 17:33:29 - [Epoch=1 | Step=3800/334762] loss=117.3167
04-Feb-26 17:34:37 - [Epoch=1 | Step=3900/334762] loss=115.7205
04-Feb-26 17:35:43 - [Epoch=1 | Step=4000/334762] loss=116.2390
04-Feb-26 17:36:52 - [Epoch=1 | Step=4100/334762] loss=110.6956
04-Feb-26 17:38:00 - [Epoch=1 | Step=4200/334762] loss=104.7810
04-Feb-26 17:39:08 - [Epoch=1 | Step=4300/334762] loss=104.1565
04-Feb-26 17:40:18 - [Epoch=1 | Step=4400/334762] loss=121.2152
04-Feb-26 17:41:28 - [Epoch=1 | Step=4500/334762] loss=114.0944
04-Feb-26 17:42:34 - [Epoch=1 | Step=4600/334762] loss=106.9002
04-Feb-26 17:43:40 - [Epoch=1 | Step=4700/334762] loss=102.8212
04-Feb-26 17:44:44 - [Epoch=1 | Step=4800/334762] loss=93.7573
04-Feb-26 17:45:49 - [Epoch=1 | Step=4900/334762] loss=105.3372
04-Feb-26 17:46:55 - [Epoch=1 | Step=5000/334762] loss=99.0281
04-Feb-26 17:47:58 - [Epoch=1 | Step=5100/334762] loss=86.4414
04-Feb-26 17:49:01 - [Epoch=1 | Step=5200/334762] loss=80.7518
04-Feb-26 17:50:04 - [Epoch=1 | Step=5300/334762] loss=86.6961
04-Feb-26 17:51:09 - [Epoch=1 | Step=5400/334762] loss=72.0949
04-Feb-26 17:52:15 - [Epoch=1 | Step=5500/334762] loss=80.6435
04-Feb-26 17:53:23 - [Epoch=1 | Step=5600/334762] loss=74.0798
04-Feb-26 17:54:29 - [Epoch=1 | Step=5700/334762] loss=65.3628
04-Feb-26 17:55:35 - [Epoch=1 | Step=5800/334762] loss=68.2473
04-Feb-26 17:56:40 - [Epoch=1 | Step=5900/334762] loss=59.7336
04-Feb-26 17:57:42 - [Epoch=1 | Step=6000/334762] loss=58.9929
04-Feb-26 17:58:41 - [Epoch=1 | Step=6100/334762] loss=55.9104
04-Feb-26 17:59:40 - [Epoch=1 | Step=6200/334762] loss=51.7730
04-Feb-26 18:00:39 - [Epoch=1 | Step=6300/334762] loss=51.3357
04-Feb-26 18:01:43 - [Epoch=1 | Step=6400/334762] loss=57.3537
04-Feb-26 18:02:47 - [Epoch=1 | Step=6500/334762] loss=42.7410
04-Feb-26 18:03:49 - [Epoch=1 | Step=6600/334762] loss=36.6798
04-Feb-26 18:04:49 - [Epoch=1 | Step=6700/334762] loss=37.5275
04-Feb-26 18:05:48 - [Epoch=1 | Step=6800/334762] loss=29.8895
04-Feb-26 18:06:48 - [Epoch=1 | Step=6900/334762] loss=40.6045
04-Feb-26 18:07:48 - [Epoch=1 | Step=7000/334762] loss=41.8307
04-Feb-26 18:08:47 - [Epoch=1 | Step=7100/334762] loss=34.4697
04-Feb-26 18:09:45 - [Epoch=1 | Step=7200/334762] loss=35.5528
04-Feb-26 18:10:43 - [Epoch=1 | Step=7300/334762] loss=30.4345
04-Feb-26 18:11:41 - [Epoch=1 | Step=7400/334762] loss=31.4796
04-Feb-26 18:12:38 - [Epoch=1 | Step=7500/334762] loss=23.0965
04-Feb-26 18:13:35 - [Epoch=1 | Step=7600/334762] loss=22.6757
04-Feb-26 18:14:31 - [Epoch=1 | Step=7700/334762] loss=21.7284
04-Feb-26 18:15:27 - [Epoch=1 | Step=7800/334762] loss=23.5395
04-Feb-26 18:16:21 - [Epoch=1 | Step=7900/334762] loss=14.5759
04-Feb-26 18:17:15 - [Epoch=1 | Step=8000/334762] loss=12.7813
04-Feb-26 18:18:09 - [Epoch=1 | Step=8100/334762] loss=12.5483
04-Feb-26 18:19:02 - [Epoch=1 | Step=8200/334762] loss=12.0791
04-Feb-26 18:19:55 - [Epoch=1 | Step=8300/334762] loss=13.1682
04-Feb-26 18:20:47 - [Epoch=1 | Step=8400/334762] loss=12.4886
04-Feb-26 18:21:39 - [Epoch=1 | Step=8500/334762] loss=6.9283
04-Feb-26 18:22:31 - [Epoch=1 | Step=8600/334762] loss=8.5978
04-Feb-26 18:23:23 - [Epoch=1 | Step=8700/334762] loss=11.4960
04-Feb-26 18:24:16 - [Epoch=1 | Step=8800/334762] loss=17.1595
04-Feb-26 18:25:08 - [Epoch=1 | Step=8900/334762] loss=19.3861
04-Feb-26 18:26:00 - [Epoch=1 | Step=9000/334762] loss=17.0166
04-Feb-26 18:26:52 - [Epoch=1 | Step=9100/334762] loss=27.3816
04-Feb-26 18:27:43 - [Epoch=1 | Step=9200/334762] loss=23.6702
04-Feb-26 18:28:35 - [Epoch=1 | Step=9300/334762] loss=29.2532
04-Feb-26 18:29:27 - [Epoch=1 | Step=9400/334762] loss=29.4020
04-Feb-26 18:30:20 - [Epoch=1 | Step=9500/334762] loss=28.7949
04-Feb-26 18:31:13 - [Epoch=1 | Step=9600/334762] loss=25.1587
04-Feb-26 18:32:06 - [Epoch=1 | Step=9700/334762] loss=29.7463
04-Feb-26 18:32:59 - [Epoch=1 | Step=9800/334762] loss=26.4046
04-Feb-26 18:33:51 - [Epoch=1 | Step=9900/334762] loss=29.3935
04-Feb-26 18:34:44 - [Epoch=1 | Step=10000/334762] loss=30.3790
04-Feb-26 18:35:36 - [Epoch=1 | Step=10100/334762] loss=24.7335
04-Feb-26 18:36:29 - [Epoch=1 | Step=10200/334762] loss=26.9708
04-Feb-26 18:37:21 - [Epoch=1 | Step=10300/334762] loss=20.5389
04-Feb-26 18:38:13 - [Epoch=1 | Step=10400/334762] loss=22.2644
04-Feb-26 18:39:05 - [Epoch=1 | Step=10500/334762] loss=12.8381
04-Feb-26 18:39:58 - [Epoch=1 | Step=10600/334762] loss=20.1807
04-Feb-26 18:40:50 - [Epoch=1 | Step=10700/334762] loss=13.8457
04-Feb-26 18:41:42 - [Epoch=1 | Step=10800/334762] loss=19.2382
04-Feb-26 18:42:35 - [Epoch=1 | Step=10900/334762] loss=14.8056
04-Feb-26 18:43:27 - [Epoch=1 | Step=11000/334762] loss=25.7866
04-Feb-26 18:44:19 - [Epoch=1 | Step=11100/334762] loss=26.6316
04-Feb-26 18:45:11 - [Epoch=1 | Step=11200/334762] loss=25.3139
04-Feb-26 18:46:03 - [Epoch=1 | Step=11300/334762] loss=22.4901
04-Feb-26 18:46:55 - [Epoch=1 | Step=11400/334762] loss=22.3218
04-Feb-26 18:47:48 - [Epoch=1 | Step=11500/334762] loss=19.2583
04-Feb-26 18:48:41 - [Epoch=1 | Step=11600/334762] loss=18.1359
04-Feb-26 18:49:33 - [Epoch=1 | Step=11700/334762] loss=17.6233
04-Feb-26 18:50:25 - [Epoch=1 | Step=11800/334762] loss=20.6511
04-Feb-26 18:51:18 - [Epoch=1 | Step=11900/334762] loss=19.2958
04-Feb-26 18:52:09 - [Epoch=1 | Step=12000/334762] loss=14.3151
04-Feb-26 18:53:02 - [Epoch=1 | Step=12100/334762] loss=18.7507
04-Feb-26 18:53:54 - [Epoch=1 | Step=12200/334762] loss=17.7199
04-Feb-26 18:54:46 - [Epoch=1 | Step=12300/334762] loss=16.6428
04-Feb-26 18:55:38 - [Epoch=1 | Step=12400/334762] loss=18.0486
04-Feb-26 18:56:30 - [Epoch=1 | Step=12500/334762] loss=18.3511
04-Feb-26 18:57:21 - [Epoch=1 | Step=12600/334762] loss=19.4350
04-Feb-26 18:58:13 - [Epoch=1 | Step=12700/334762] loss=18.7681
04-Feb-26 18:59:04 - [Epoch=1 | Step=12800/334762] loss=17.1844
04-Feb-26 18:59:56 - [Epoch=1 | Step=12900/334762] loss=13.4834
04-Feb-26 19:00:47 - [Epoch=1 | Step=13000/334762] loss=13.6986
04-Feb-26 19:01:40 - [Epoch=1 | Step=13100/334762] loss=14.6493
04-Feb-26 19:02:32 - [Epoch=1 | Step=13200/334762] loss=15.6742
04-Feb-26 19:03:25 - [Epoch=1 | Step=13300/334762] loss=12.2082
04-Feb-26 19:04:17 - [Epoch=1 | Step=13400/334762] loss=13.2774
04-Feb-26 19:05:11 - [Epoch=1 | Step=13500/334762] loss=8.5102
04-Feb-26 19:06:02 - [Epoch=1 | Step=13600/334762] loss=10.5084
04-Feb-26 19:06:54 - [Epoch=1 | Step=13700/334762] loss=9.9713
04-Feb-26 19:07:47 - [Epoch=1 | Step=13800/334762] loss=8.3870
04-Feb-26 19:08:39 - [Epoch=1 | Step=13900/334762] loss=6.5166
04-Feb-26 19:09:30 - [Epoch=1 | Step=14000/334762] loss=6.7655
04-Feb-26 19:10:23 - [Epoch=1 | Step=14100/334762] loss=10.1002
04-Feb-26 19:11:14 - [Epoch=1 | Step=14200/334762] loss=7.7576
04-Feb-26 19:12:06 - [Epoch=1 | Step=14300/334762] loss=9.0071
04-Feb-26 19:13:00 - [Epoch=1 | Step=14400/334762] loss=11.7789
04-Feb-26 19:13:52 - [Epoch=1 | Step=14500/334762] loss=11.8952
04-Feb-26 19:14:44 - [Epoch=1 | Step=14600/334762] loss=11.8626
04-Feb-26 19:15:36 - [Epoch=1 | Step=14700/334762] loss=13.3115
04-Feb-26 19:16:28 - [Epoch=1 | Step=14800/334762] loss=15.7258
04-Feb-26 19:17:20 - [Epoch=1 | Step=14900/334762] loss=17.4739
04-Feb-26 19:18:11 - [Epoch=1 | Step=15000/334762] loss=21.6972
04-Feb-26 19:19:02 - [Epoch=1 | Step=15100/334762] loss=23.9133
04-Feb-26 19:19:54 - [Epoch=1 | Step=15200/334762] loss=23.1102
04-Feb-26 19:20:46 - [Epoch=1 | Step=15300/334762] loss=20.4268
04-Feb-26 19:21:38 - [Epoch=1 | Step=15400/334762] loss=23.1174
04-Feb-26 19:22:29 - [Epoch=1 | Step=15500/334762] loss=14.9720
04-Feb-26 19:23:21 - [Epoch=1 | Step=15600/334762] loss=18.3459
04-Feb-26 19:24:12 - [Epoch=1 | Step=15700/334762] loss=17.2829
04-Feb-26 19:25:04 - [Epoch=1 | Step=15800/334762] loss=12.8104
04-Feb-26 19:25:56 - [Epoch=1 | Step=15900/334762] loss=10.7736
04-Feb-26 19:26:47 - [Epoch=1 | Step=16000/334762] loss=11.6813
04-Feb-26 19:27:38 - [Epoch=1 | Step=16100/334762] loss=9.7570
04-Feb-26 19:28:29 - [Epoch=1 | Step=16200/334762] loss=10.3999
04-Feb-26 19:29:21 - [Epoch=1 | Step=16300/334762] loss=9.4565
04-Feb-26 19:30:12 - [Epoch=1 | Step=16400/334762] loss=11.7859
04-Feb-26 19:31:03 - [Epoch=1 | Step=16500/334762] loss=11.0411
04-Feb-26 19:31:54 - [Epoch=1 | Step=16600/334762] loss=11.8831
04-Feb-26 19:32:45 - [Epoch=1 | Step=16700/334762] loss=13.5080
04-Feb-26 19:33:36 - [Epoch=1 | Step=16800/334762] loss=10.2800
04-Feb-26 19:34:27 - [Epoch=1 | Step=16900/334762] loss=17.1015
04-Feb-26 19:35:18 - [Epoch=1 | Step=17000/334762] loss=14.4906
04-Feb-26 19:36:10 - [Epoch=1 | Step=17100/334762] loss=12.0293
04-Feb-26 19:37:00 - [Epoch=1 | Step=17200/334762] loss=13.7611
04-Feb-26 19:37:51 - [Epoch=1 | Step=17300/334762] loss=11.2972
04-Feb-26 19:38:43 - [Epoch=1 | Step=17400/334762] loss=17.2858
04-Feb-26 19:39:34 - [Epoch=1 | Step=17500/334762] loss=14.6533
04-Feb-26 19:40:24 - [Epoch=1 | Step=17600/334762] loss=14.9802
04-Feb-26 19:41:16 - [Epoch=1 | Step=17700/334762] loss=13.2025
04-Feb-26 19:42:08 - [Epoch=1 | Step=17800/334762] loss=12.5372
04-Feb-26 19:42:59 - [Epoch=1 | Step=17900/334762] loss=13.4370
04-Feb-26 19:43:50 - [Epoch=1 | Step=18000/334762] loss=13.5307
04-Feb-26 19:44:43 - [Epoch=1 | Step=18100/334762] loss=14.1105
04-Feb-26 19:45:37 - [Epoch=1 | Step=18200/334762] loss=12.1079
04-Feb-26 19:46:32 - [Epoch=1 | Step=18300/334762] loss=19.7784
04-Feb-26 19:47:27 - [Epoch=1 | Step=18400/334762] loss=14.5713
04-Feb-26 19:48:22 - [Epoch=1 | Step=18500/334762] loss=15.0606
04-Feb-26 19:49:17 - [Epoch=1 | Step=18600/334762] loss=18.1861
04-Feb-26 19:50:12 - [Epoch=1 | Step=18700/334762] loss=17.8624
04-Feb-26 19:51:07 - [Epoch=1 | Step=18800/334762] loss=18.1834
04-Feb-26 19:52:02 - [Epoch=1 | Step=18900/334762] loss=15.1607
04-Feb-26 19:52:58 - [Epoch=1 | Step=19000/334762] loss=16.7602
04-Feb-26 19:53:53 - [Epoch=1 | Step=19100/334762] loss=11.6273
04-Feb-26 19:54:46 - [Epoch=1 | Step=19200/334762] loss=17.4616
04-Feb-26 19:55:39 - [Epoch=1 | Step=19300/334762] loss=16.9233
04-Feb-26 19:56:32 - [Epoch=1 | Step=19400/334762] loss=16.8120
04-Feb-26 19:57:25 - [Epoch=1 | Step=19500/334762] loss=22.8264
04-Feb-26 19:58:18 - [Epoch=1 | Step=19600/334762] loss=24.9073
04-Feb-26 19:59:10 - [Epoch=1 | Step=19700/334762] loss=20.4643
04-Feb-26 20:00:02 - [Epoch=1 | Step=19800/334762] loss=21.9056
04-Feb-26 20:00:54 - [Epoch=1 | Step=19900/334762] loss=17.6343
04-Feb-26 20:01:46 - [Epoch=1 | Step=20000/334762] loss=16.0772
04-Feb-26 20:02:38 - [Epoch=1 | Step=20100/334762] loss=18.4138
04-Feb-26 20:03:29 - [Epoch=1 | Step=20200/334762] loss=19.2573
04-Feb-26 20:04:21 - [Epoch=1 | Step=20300/334762] loss=17.5733
04-Feb-26 20:05:12 - [Epoch=1 | Step=20400/334762] loss=12.3307
04-Feb-26 20:06:04 - [Epoch=1 | Step=20500/334762] loss=10.2798
04-Feb-26 20:06:55 - [Epoch=1 | Step=20600/334762] loss=11.2090
04-Feb-26 20:07:47 - [Epoch=1 | Step=20700/334762] loss=14.1955
04-Feb-26 20:08:37 - [Epoch=1 | Step=20800/334762] loss=11.0403
04-Feb-26 20:09:28 - [Epoch=1 | Step=20900/334762] loss=8.3329
04-Feb-26 20:10:18 - [Epoch=1 | Step=21000/334762] loss=9.3816
04-Feb-26 20:11:09 - [Epoch=1 | Step=21100/334762] loss=14.1610
04-Feb-26 20:12:00 - [Epoch=1 | Step=21200/334762] loss=10.6420
04-Feb-26 20:12:51 - [Epoch=1 | Step=21300/334762] loss=9.9917
04-Feb-26 20:13:42 - [Epoch=1 | Step=21400/334762] loss=10.7369
04-Feb-26 20:14:33 - [Epoch=1 | Step=21500/334762] loss=9.9155
04-Feb-26 20:15:24 - [Epoch=1 | Step=21600/334762] loss=8.6432
04-Feb-26 20:16:15 - [Epoch=1 | Step=21700/334762] loss=7.3977
04-Feb-26 20:17:06 - [Epoch=1 | Step=21800/334762] loss=9.0940
04-Feb-26 20:17:58 - [Epoch=1 | Step=21900/334762] loss=8.2552
04-Feb-26 20:18:49 - [Epoch=1 | Step=22000/334762] loss=9.3923
04-Feb-26 20:19:40 - [Epoch=1 | Step=22100/334762] loss=10.1183
04-Feb-26 20:20:32 - [Epoch=1 | Step=22200/334762] loss=9.2197
04-Feb-26 20:21:23 - [Epoch=1 | Step=22300/334762] loss=9.4797
04-Feb-26 20:22:14 - [Epoch=1 | Step=22400/334762] loss=8.5622
04-Feb-26 20:23:05 - [Epoch=1 | Step=22500/334762] loss=7.8082
04-Feb-26 20:23:56 - [Epoch=1 | Step=22600/334762] loss=6.7686
04-Feb-26 20:24:48 - [Epoch=1 | Step=22700/334762] loss=6.7759
04-Feb-26 20:25:39 - [Epoch=1 | Step=22800/334762] loss=8.3296
04-Feb-26 20:26:30 - [Epoch=1 | Step=22900/334762] loss=7.1575
04-Feb-26 20:27:22 - [Epoch=1 | Step=23000/334762] loss=6.4842
04-Feb-26 20:28:14 - [Epoch=1 | Step=23100/334762] loss=10.1040
04-Feb-26 20:29:05 - [Epoch=1 | Step=23200/334762] loss=10.9530
04-Feb-26 20:29:57 - [Epoch=1 | Step=23300/334762] loss=16.4785
04-Feb-26 20:30:49 - [Epoch=1 | Step=23400/334762] loss=18.9424
04-Feb-26 20:31:40 - [Epoch=1 | Step=23500/334762] loss=16.6482
04-Feb-26 20:32:31 - [Epoch=1 | Step=23600/334762] loss=15.6887
04-Feb-26 20:33:23 - [Epoch=1 | Step=23700/334762] loss=15.9974
04-Feb-26 20:34:14 - [Epoch=1 | Step=23800/334762] loss=20.0552
04-Feb-26 20:35:06 - [Epoch=1 | Step=23900/334762] loss=17.5980
04-Feb-26 20:35:57 - [Epoch=1 | Step=24000/334762] loss=15.2273
04-Feb-26 20:36:49 - [Epoch=1 | Step=24100/334762] loss=21.6011
04-Feb-26 20:37:41 - [Epoch=1 | Step=24200/334762] loss=15.1479
04-Feb-26 20:38:32 - [Epoch=1 | Step=24300/334762] loss=10.7180
04-Feb-26 20:39:24 - [Epoch=1 | Step=24400/334762] loss=11.8014
04-Feb-26 20:40:17 - [Epoch=1 | Step=24500/334762] loss=17.1677
04-Feb-26 20:41:09 - [Epoch=1 | Step=24600/334762] loss=14.5156
04-Feb-26 20:42:01 - [Epoch=1 | Step=24700/334762] loss=19.7933
04-Feb-26 20:42:52 - [Epoch=1 | Step=24800/334762] loss=14.8337
04-Feb-26 20:43:44 - [Epoch=1 | Step=24900/334762] loss=10.9467
04-Feb-26 20:44:35 - [Epoch=1 | Step=25000/334762] loss=16.3617
04-Feb-26 20:45:27 - [Epoch=1 | Step=25100/334762] loss=17.2558
04-Feb-26 20:46:19 - [Epoch=1 | Step=25200/334762] loss=14.0153
04-Feb-26 20:47:11 - [Epoch=1 | Step=25300/334762] loss=13.6224
04-Feb-26 20:48:02 - [Epoch=1 | Step=25400/334762] loss=20.3452
04-Feb-26 20:48:54 - [Epoch=1 | Step=25500/334762] loss=14.9779
04-Feb-26 20:49:45 - [Epoch=1 | Step=25600/334762] loss=12.4848
04-Feb-26 20:50:36 - [Epoch=1 | Step=25700/334762] loss=16.2906
04-Feb-26 20:51:28 - [Epoch=1 | Step=25800/334762] loss=13.1655
04-Feb-26 20:52:19 - [Epoch=1 | Step=25900/334762] loss=14.4011
04-Feb-26 20:53:11 - [Epoch=1 | Step=26000/334762] loss=16.0442
04-Feb-26 20:54:03 - [Epoch=1 | Step=26100/334762] loss=16.3429
04-Feb-26 20:54:54 - [Epoch=1 | Step=26200/334762] loss=14.4424
04-Feb-26 20:55:46 - [Epoch=1 | Step=26300/334762] loss=16.7835
04-Feb-26 20:56:37 - [Epoch=1 | Step=26400/334762] loss=16.6344
04-Feb-26 20:57:30 - [Epoch=1 | Step=26500/334762] loss=17.2780
04-Feb-26 20:58:21 - [Epoch=1 | Step=26600/334762] loss=14.4769
04-Feb-26 20:59:14 - [Epoch=1 | Step=26700/334762] loss=19.4376
04-Feb-26 21:00:05 - [Epoch=1 | Step=26800/334762] loss=17.1497
04-Feb-26 21:00:57 - [Epoch=1 | Step=26900/334762] loss=13.2701
04-Feb-26 21:01:49 - [Epoch=1 | Step=27000/334762] loss=15.9728
04-Feb-26 21:02:41 - [Epoch=1 | Step=27100/334762] loss=17.0660
04-Feb-26 21:03:33 - [Epoch=1 | Step=27200/334762] loss=10.9690
04-Feb-26 21:04:25 - [Epoch=1 | Step=27300/334762] loss=11.8176
04-Feb-26 21:05:16 - [Epoch=1 | Step=27400/334762] loss=13.4358
04-Feb-26 21:06:08 - [Epoch=1 | Step=27500/334762] loss=13.6432
04-Feb-26 21:07:00 - [Epoch=1 | Step=27600/334762] loss=12.5135
04-Feb-26 21:07:52 - [Epoch=1 | Step=27700/334762] loss=9.6623
04-Feb-26 21:08:43 - [Epoch=1 | Step=27800/334762] loss=12.7545
04-Feb-26 21:09:35 - [Epoch=1 | Step=27900/334762] loss=10.7026
04-Feb-26 21:10:27 - [Epoch=1 | Step=28000/334762] loss=11.1544
04-Feb-26 21:11:19 - [Epoch=1 | Step=28100/334762] loss=16.8650
04-Feb-26 21:12:11 - [Epoch=1 | Step=28200/334762] loss=10.9017
04-Feb-26 21:13:03 - [Epoch=1 | Step=28300/334762] loss=14.6847
04-Feb-26 21:13:54 - [Epoch=1 | Step=28400/334762] loss=16.6518
04-Feb-26 21:14:46 - [Epoch=1 | Step=28500/334762] loss=15.5275
04-Feb-26 21:15:38 - [Epoch=1 | Step=28600/334762] loss=12.9175
04-Feb-26 21:16:30 - [Epoch=1 | Step=28700/334762] loss=13.7111
04-Feb-26 21:17:21 - [Epoch=1 | Step=28800/334762] loss=13.4958
04-Feb-26 21:18:13 - [Epoch=1 | Step=28900/334762] loss=13.0949
04-Feb-26 21:19:04 - [Epoch=1 | Step=29000/334762] loss=13.7699
04-Feb-26 21:19:55 - [Epoch=1 | Step=29100/334762] loss=16.2461
04-Feb-26 21:20:47 - [Epoch=1 | Step=29200/334762] loss=10.1207
04-Feb-26 21:21:39 - [Epoch=1 | Step=29300/334762] loss=16.7098
04-Feb-26 21:22:31 - [Epoch=1 | Step=29400/334762] loss=13.2863
04-Feb-26 21:23:22 - [Epoch=1 | Step=29500/334762] loss=14.4022
04-Feb-26 21:24:14 - [Epoch=1 | Step=29600/334762] loss=15.5581
04-Feb-26 21:25:05 - [Epoch=1 | Step=29700/334762] loss=11.3403
04-Feb-26 21:25:57 - [Epoch=1 | Step=29800/334762] loss=10.9576
04-Feb-26 21:26:49 - [Epoch=1 | Step=29900/334762] loss=11.0620
04-Feb-26 21:27:42 - [Epoch=1 | Step=30000/334762] loss=8.1281
04-Feb-26 21:28:35 - [Epoch=1 | Step=30100/334762] loss=9.5141
04-Feb-26 21:29:29 - [Epoch=1 | Step=30200/334762] loss=8.7354
04-Feb-26 21:30:23 - [Epoch=1 | Step=30300/334762] loss=10.2599
04-Feb-26 21:31:16 - [Epoch=1 | Step=30400/334762] loss=8.2775
04-Feb-26 21:32:10 - [Epoch=1 | Step=30500/334762] loss=7.9335
04-Feb-26 21:33:04 - [Epoch=1 | Step=30600/334762] loss=7.8227
04-Feb-26 21:33:58 - [Epoch=1 | Step=30700/334762] loss=8.5716
04-Feb-26 21:34:51 - [Epoch=1 | Step=30800/334762] loss=7.0562
04-Feb-26 21:35:45 - [Epoch=1 | Step=30900/334762] loss=5.5641
04-Feb-26 21:36:39 - [Epoch=1 | Step=31000/334762] loss=6.5667
04-Feb-26 21:37:33 - [Epoch=1 | Step=31100/334762] loss=6.6426
04-Feb-26 21:38:27 - [Epoch=1 | Step=31200/334762] loss=8.2619
04-Feb-26 21:39:21 - [Epoch=1 | Step=31300/334762] loss=6.1330
04-Feb-26 21:40:15 - [Epoch=1 | Step=31400/334762] loss=7.4386
04-Feb-26 21:41:09 - [Epoch=1 | Step=31500/334762] loss=11.2232
04-Feb-26 21:42:03 - [Epoch=1 | Step=31600/334762] loss=7.2783
04-Feb-26 21:42:57 - [Epoch=1 | Step=31700/334762] loss=9.1657
04-Feb-26 21:43:51 - [Epoch=1 | Step=31800/334762] loss=8.3285
04-Feb-26 21:44:45 - [Epoch=1 | Step=31900/334762] loss=8.8193
04-Feb-26 21:45:39 - [Epoch=1 | Step=32000/334762] loss=8.1796
04-Feb-26 21:46:33 - [Epoch=1 | Step=32100/334762] loss=9.2246
04-Feb-26 21:47:26 - [Epoch=1 | Step=32200/334762] loss=7.1129
04-Feb-26 21:48:20 - [Epoch=1 | Step=32300/334762] loss=11.0341
04-Feb-26 21:49:14 - [Epoch=1 | Step=32400/334762] loss=9.5079
04-Feb-26 21:50:07 - [Epoch=1 | Step=32500/334762] loss=7.1146
04-Feb-26 21:51:01 - [Epoch=1 | Step=32600/334762] loss=9.0834
04-Feb-26 21:51:54 - [Epoch=1 | Step=32700/334762] loss=11.3627
04-Feb-26 21:52:48 - [Epoch=1 | Step=32800/334762] loss=14.1429
04-Feb-26 21:53:43 - [Epoch=1 | Step=32900/334762] loss=11.8824
04-Feb-26 21:54:37 - [Epoch=1 | Step=33000/334762] loss=11.2381
04-Feb-26 21:55:31 - [Epoch=1 | Step=33100/334762] loss=12.5786
04-Feb-26 21:56:26 - [Epoch=1 | Step=33200/334762] loss=8.7925
04-Feb-26 21:57:20 - [Epoch=1 | Step=33300/334762] loss=7.8996
04-Feb-26 21:58:14 - [Epoch=1 | Step=33400/334762] loss=8.2938
04-Feb-26 21:59:08 - [Epoch=1 | Step=33500/334762] loss=10.5839
04-Feb-26 22:00:03 - [Epoch=1 | Step=33600/334762] loss=9.8385
04-Feb-26 22:00:57 - [Epoch=1 | Step=33700/334762] loss=8.5518
04-Feb-26 22:01:52 - [Epoch=1 | Step=33800/334762] loss=9.8626
04-Feb-26 22:02:46 - [Epoch=1 | Step=33900/334762] loss=10.2096
04-Feb-26 22:03:40 - [Epoch=1 | Step=34000/334762] loss=7.3307
04-Feb-26 22:04:34 - [Epoch=1 | Step=34100/334762] loss=10.8898
04-Feb-26 22:05:28 - [Epoch=1 | Step=34200/334762] loss=9.7460
04-Feb-26 22:06:22 - [Epoch=1 | Step=34300/334762] loss=8.2702
04-Feb-26 22:07:16 - [Epoch=1 | Step=34400/334762] loss=7.1172
04-Feb-26 22:08:10 - [Epoch=1 | Step=34500/334762] loss=7.6390
04-Feb-26 22:09:05 - [Epoch=1 | Step=34600/334762] loss=8.0806
04-Feb-26 22:10:00 - [Epoch=1 | Step=34700/334762] loss=8.5460
04-Feb-26 22:10:56 - [Epoch=1 | Step=34800/334762] loss=6.3645
04-Feb-26 22:11:54 - [Epoch=1 | Step=34900/334762] loss=7.6566
04-Feb-26 22:12:52 - [Epoch=1 | Step=35000/334762] loss=7.1683
04-Feb-26 22:13:51 - [Epoch=1 | Step=35100/334762] loss=7.4183
04-Feb-26 22:14:49 - [Epoch=1 | Step=35200/334762] loss=5.7412
04-Feb-26 22:15:48 - [Epoch=1 | Step=35300/334762] loss=6.7536
04-Feb-26 22:16:46 - [Epoch=1 | Step=35400/334762] loss=5.7275
04-Feb-26 22:17:44 - [Epoch=1 | Step=35500/334762] loss=6.7213
04-Feb-26 22:18:42 - [Epoch=1 | Step=35600/334762] loss=5.9480
04-Feb-26 22:19:40 - [Epoch=1 | Step=35700/334762] loss=8.8889
04-Feb-26 22:20:39 - [Epoch=1 | Step=35800/334762] loss=6.9227
04-Feb-26 22:21:37 - [Epoch=1 | Step=35900/334762] loss=7.1006
04-Feb-26 22:22:35 - [Epoch=1 | Step=36000/334762] loss=7.6750
04-Feb-26 22:23:33 - [Epoch=1 | Step=36100/334762] loss=8.5821
04-Feb-26 22:24:32 - [Epoch=1 | Step=36200/334762] loss=6.3241
04-Feb-26 22:25:30 - [Epoch=1 | Step=36300/334762] loss=5.8275
04-Feb-26 22:26:27 - [Epoch=1 | Step=36400/334762] loss=6.3981
04-Feb-26 22:27:21 - [Epoch=1 | Step=36500/334762] loss=5.6449
04-Feb-26 22:28:15 - [Epoch=1 | Step=36600/334762] loss=6.5101
04-Feb-26 22:29:08 - [Epoch=1 | Step=36700/334762] loss=5.7364
04-Feb-26 22:30:01 - [Epoch=1 | Step=36800/334762] loss=6.4851
04-Feb-26 22:30:59 - [Epoch=1 | Step=36900/334762] loss=8.6259
04-Feb-26 22:31:57 - [Epoch=1 | Step=37000/334762] loss=8.5944
04-Feb-26 22:32:55 - [Epoch=1 | Step=37100/334762] loss=10.8132
04-Feb-26 22:33:54 - [Epoch=1 | Step=37200/334762] loss=12.5444
04-Feb-26 22:34:53 - [Epoch=1 | Step=37300/334762] loss=8.6545
04-Feb-26 22:35:52 - [Epoch=1 | Step=37400/334762] loss=8.6496
04-Feb-26 22:36:52 - [Epoch=1 | Step=37500/334762] loss=11.0736
04-Feb-26 22:37:53 - [Epoch=1 | Step=37600/334762] loss=11.7237
04-Feb-26 22:38:54 - [Epoch=1 | Step=37700/334762] loss=8.8524
04-Feb-26 22:39:55 - [Epoch=1 | Step=37800/334762] loss=15.3620
04-Feb-26 22:40:55 - [Epoch=1 | Step=37900/334762] loss=13.2051
04-Feb-26 22:41:55 - [Epoch=1 | Step=38000/334762] loss=19.8027
04-Feb-26 22:42:54 - [Epoch=1 | Step=38100/334762] loss=15.2396
04-Feb-26 22:43:54 - [Epoch=1 | Step=38200/334762] loss=14.6506
04-Feb-26 22:44:53 - [Epoch=1 | Step=38300/334762] loss=12.9205
04-Feb-26 22:45:52 - [Epoch=1 | Step=38400/334762] loss=14.3794
04-Feb-26 22:46:52 - [Epoch=1 | Step=38500/334762] loss=15.8916
04-Feb-26 22:47:51 - [Epoch=1 | Step=38600/334762] loss=14.8013
04-Feb-26 22:48:51 - [Epoch=1 | Step=38700/334762] loss=19.0795
04-Feb-26 22:49:50 - [Epoch=1 | Step=38800/334762] loss=15.1058
04-Feb-26 22:50:49 - [Epoch=1 | Step=38900/334762] loss=16.3438
04-Feb-26 22:51:50 - [Epoch=1 | Step=39000/334762] loss=13.6173
04-Feb-26 22:52:51 - [Epoch=1 | Step=39100/334762] loss=15.5104
04-Feb-26 22:53:52 - [Epoch=1 | Step=39200/334762] loss=15.0625
04-Feb-26 22:54:53 - [Epoch=1 | Step=39300/334762] loss=10.7895
04-Feb-26 22:55:55 - [Epoch=1 | Step=39400/334762] loss=14.3139
04-Feb-26 22:56:56 - [Epoch=1 | Step=39500/334762] loss=12.4943
04-Feb-26 22:57:58 - [Epoch=1 | Step=39600/334762] loss=17.1440
04-Feb-26 22:58:59 - [Epoch=1 | Step=39700/334762] loss=12.1218
04-Feb-26 23:00:00 - [Epoch=1 | Step=39800/334762] loss=14.1629
04-Feb-26 23:00:59 - [Epoch=1 | Step=39900/334762] loss=10.7742
04-Feb-26 23:01:59 - [Epoch=1 | Step=40000/334762] loss=14.7565
04-Feb-26 23:02:58 - [Epoch=1 | Step=40100/334762] loss=10.4558
04-Feb-26 23:03:57 - [Epoch=1 | Step=40200/334762] loss=8.5940
04-Feb-26 23:04:56 - [Epoch=1 | Step=40300/334762] loss=9.4184
04-Feb-26 23:05:55 - [Epoch=1 | Step=40400/334762] loss=6.7168
04-Feb-26 23:06:54 - [Epoch=1 | Step=40500/334762] loss=13.0237
04-Feb-26 23:07:53 - [Epoch=1 | Step=40600/334762] loss=9.1478
04-Feb-26 23:08:51 - [Epoch=1 | Step=40700/334762] loss=10.7740
04-Feb-26 23:09:50 - [Epoch=1 | Step=40800/334762] loss=10.3980
04-Feb-26 23:10:48 - [Epoch=1 | Step=40900/334762] loss=14.3607
04-Feb-26 23:11:46 - [Epoch=1 | Step=41000/334762] loss=8.4924
04-Feb-26 23:12:42 - [Epoch=1 | Step=41100/334762] loss=10.1952
04-Feb-26 23:13:38 - [Epoch=1 | Step=41200/334762] loss=12.4978
04-Feb-26 23:14:35 - [Epoch=1 | Step=41300/334762] loss=10.4920
04-Feb-26 23:15:31 - [Epoch=1 | Step=41400/334762] loss=11.6220
04-Feb-26 23:16:25 - [Epoch=1 | Step=41500/334762] loss=11.2458
04-Feb-26 23:17:20 - [Epoch=1 | Step=41600/334762] loss=11.1789
04-Feb-26 23:18:14 - [Epoch=1 | Step=41700/334762] loss=8.1045
04-Feb-26 23:19:08 - [Epoch=1 | Step=41800/334762] loss=8.1673
04-Feb-26 23:20:02 - [Epoch=1 | Step=41900/334762] loss=6.6463
04-Feb-26 23:20:55 - [Epoch=1 | Step=42000/334762] loss=5.9181
04-Feb-26 23:21:48 - [Epoch=1 | Step=42100/334762] loss=7.8639
04-Feb-26 23:22:42 - [Epoch=1 | Step=42200/334762] loss=8.5868
04-Feb-26 23:23:35 - [Epoch=1 | Step=42300/334762] loss=7.0605
04-Feb-26 23:24:29 - [Epoch=1 | Step=42400/334762] loss=5.5379
04-Feb-26 23:25:22 - [Epoch=1 | Step=42500/334762] loss=5.4087
04-Feb-26 23:26:14 - [Epoch=1 | Step=42600/334762] loss=6.8130
04-Feb-26 23:27:07 - [Epoch=1 | Step=42700/334762] loss=6.1571
04-Feb-26 23:28:00 - [Epoch=1 | Step=42800/334762] loss=5.1397
04-Feb-26 23:28:53 - [Epoch=1 | Step=42900/334762] loss=5.9388
04-Feb-26 23:29:45 - [Epoch=1 | Step=43000/334762] loss=4.4887
04-Feb-26 23:30:38 - [Epoch=1 | Step=43100/334762] loss=6.2975
04-Feb-26 23:31:31 - [Epoch=1 | Step=43200/334762] loss=5.5569
04-Feb-26 23:32:24 - [Epoch=1 | Step=43300/334762] loss=6.2526
04-Feb-26 23:33:16 - [Epoch=1 | Step=43400/334762] loss=6.2390
04-Feb-26 23:34:09 - [Epoch=1 | Step=43500/334762] loss=5.3856
04-Feb-26 23:35:02 - [Epoch=1 | Step=43600/334762] loss=5.0078
04-Feb-26 23:35:55 - [Epoch=1 | Step=43700/334762] loss=5.8385
04-Feb-26 23:36:48 - [Epoch=1 | Step=43800/334762] loss=6.8279
04-Feb-26 23:37:41 - [Epoch=1 | Step=43900/334762] loss=6.6692
04-Feb-26 23:38:34 - [Epoch=1 | Step=44000/334762] loss=4.7180
04-Feb-26 23:39:28 - [Epoch=1 | Step=44100/334762] loss=4.8084
04-Feb-26 23:40:21 - [Epoch=1 | Step=44200/334762] loss=9.0285
04-Feb-26 23:41:14 - [Epoch=1 | Step=44300/334762] loss=9.7454
04-Feb-26 23:42:08 - [Epoch=1 | Step=44400/334762] loss=7.4802
04-Feb-26 23:43:02 - [Epoch=1 | Step=44500/334762] loss=14.5010
04-Feb-26 23:43:55 - [Epoch=1 | Step=44600/334762] loss=10.3039
04-Feb-26 23:44:49 - [Epoch=1 | Step=44700/334762] loss=13.0144
04-Feb-26 23:45:43 - [Epoch=1 | Step=44800/334762] loss=11.8806
04-Feb-26 23:46:37 - [Epoch=1 | Step=44900/334762] loss=12.9045
04-Feb-26 23:47:31 - [Epoch=1 | Step=45000/334762] loss=12.1455
04-Feb-26 23:48:25 - [Epoch=1 | Step=45100/334762] loss=8.0464
04-Feb-26 23:49:19 - [Epoch=1 | Step=45200/334762] loss=9.9983
04-Feb-26 23:50:13 - [Epoch=1 | Step=45300/334762] loss=7.8644
04-Feb-26 23:51:07 - [Epoch=1 | Step=45400/334762] loss=6.2119
04-Feb-26 23:52:02 - [Epoch=1 | Step=45500/334762] loss=5.8494
04-Feb-26 23:52:56 - [Epoch=1 | Step=45600/334762] loss=6.9558
04-Feb-26 23:53:50 - [Epoch=1 | Step=45700/334762] loss=6.7862
04-Feb-26 23:54:45 - [Epoch=1 | Step=45800/334762] loss=9.2682
04-Feb-26 23:55:39 - [Epoch=1 | Step=45900/334762] loss=10.0047
04-Feb-26 23:56:34 - [Epoch=1 | Step=46000/334762] loss=7.7294
04-Feb-26 23:57:27 - [Epoch=1 | Step=46100/334762] loss=11.8401
04-Feb-26 23:58:21 - [Epoch=1 | Step=46200/334762] loss=11.4050
04-Feb-26 23:59:14 - [Epoch=1 | Step=46300/334762] loss=12.7410
05-Feb-26 00:00:07 - [Epoch=1 | Step=46400/334762] loss=12.2306
05-Feb-26 00:01:00 - [Epoch=1 | Step=46500/334762] loss=15.5377
05-Feb-26 00:01:54 - [Epoch=1 | Step=46600/334762] loss=10.3892
05-Feb-26 00:02:47 - [Epoch=1 | Step=46700/334762] loss=10.2473
05-Feb-26 00:03:40 - [Epoch=1 | Step=46800/334762] loss=11.3616
05-Feb-26 00:04:34 - [Epoch=1 | Step=46900/334762] loss=9.2129
05-Feb-26 00:05:27 - [Epoch=1 | Step=47000/334762] loss=12.6912
05-Feb-26 00:06:20 - [Epoch=1 | Step=47100/334762] loss=8.8309
05-Feb-26 00:07:14 - [Epoch=1 | Step=47200/334762] loss=7.6728
05-Feb-26 00:08:07 - [Epoch=1 | Step=47300/334762] loss=11.0706
05-Feb-26 00:09:01 - [Epoch=1 | Step=47400/334762] loss=10.4133
05-Feb-26 00:09:54 - [Epoch=1 | Step=47500/334762] loss=10.5949
05-Feb-26 00:10:48 - [Epoch=1 | Step=47600/334762] loss=9.7936
05-Feb-26 00:11:41 - [Epoch=1 | Step=47700/334762] loss=13.8312
05-Feb-26 00:12:35 - [Epoch=1 | Step=47800/334762] loss=13.7953
05-Feb-26 00:13:28 - [Epoch=1 | Step=47900/334762] loss=10.4593
05-Feb-26 00:14:21 - [Epoch=1 | Step=48000/334762] loss=11.1245
05-Feb-26 00:15:15 - [Epoch=1 | Step=48100/334762] loss=15.0182
05-Feb-26 00:16:08 - [Epoch=1 | Step=48200/334762] loss=14.3552
05-Feb-26 00:17:01 - [Epoch=1 | Step=48300/334762] loss=15.9614
05-Feb-26 00:17:54 - [Epoch=1 | Step=48400/334762] loss=9.3605
05-Feb-26 00:18:48 - [Epoch=1 | Step=48500/334762] loss=13.0663
05-Feb-26 00:19:41 - [Epoch=1 | Step=48600/334762] loss=13.4084
05-Feb-26 00:20:34 - [Epoch=1 | Step=48700/334762] loss=10.7976
05-Feb-26 00:21:28 - [Epoch=1 | Step=48800/334762] loss=9.3293
05-Feb-26 00:22:21 - [Epoch=1 | Step=48900/334762] loss=9.1468
05-Feb-26 00:23:14 - [Epoch=1 | Step=49000/334762] loss=9.2014
05-Feb-26 00:24:08 - [Epoch=1 | Step=49100/334762] loss=6.2487
05-Feb-26 00:25:02 - [Epoch=1 | Step=49200/334762] loss=7.5239
05-Feb-26 00:25:55 - [Epoch=1 | Step=49300/334762] loss=5.6913
05-Feb-26 00:26:49 - [Epoch=1 | Step=49400/334762] loss=7.9773
05-Feb-26 00:27:42 - [Epoch=1 | Step=49500/334762] loss=6.4696
05-Feb-26 00:28:36 - [Epoch=1 | Step=49600/334762] loss=6.3184
05-Feb-26 00:29:30 - [Epoch=1 | Step=49700/334762] loss=4.8960
05-Feb-26 00:30:24 - [Epoch=1 | Step=49800/334762] loss=7.4248
05-Feb-26 00:31:18 - [Epoch=1 | Step=49900/334762] loss=10.1001
05-Feb-26 00:32:12 - [Epoch=1 | Step=50000/334762] loss=9.6032
05-Feb-26 00:33:06 - [Epoch=1 | Step=50100/334762] loss=10.1025
05-Feb-26 00:34:01 - [Epoch=1 | Step=50200/334762] loss=11.0388
05-Feb-26 00:34:55 - [Epoch=1 | Step=50300/334762] loss=11.5537
05-Feb-26 00:35:49 - [Epoch=1 | Step=50400/334762] loss=12.0813
05-Feb-26 00:36:42 - [Epoch=1 | Step=50500/334762] loss=11.8531
05-Feb-26 00:37:36 - [Epoch=1 | Step=50600/334762] loss=10.5283
05-Feb-26 00:38:30 - [Epoch=1 | Step=50700/334762] loss=12.8300
05-Feb-26 00:39:24 - [Epoch=1 | Step=50800/334762] loss=10.4745
05-Feb-26 00:40:18 - [Epoch=1 | Step=50900/334762] loss=15.7768
05-Feb-26 00:41:13 - [Epoch=1 | Step=51000/334762] loss=12.9202
05-Feb-26 00:42:06 - [Epoch=1 | Step=51100/334762] loss=13.3411
05-Feb-26 00:43:01 - [Epoch=1 | Step=51200/334762] loss=13.1399
05-Feb-26 00:43:55 - [Epoch=1 | Step=51300/334762] loss=11.6628
05-Feb-26 00:44:49 - [Epoch=1 | Step=51400/334762] loss=16.9155
05-Feb-26 00:45:42 - [Epoch=1 | Step=51500/334762] loss=10.8706
05-Feb-26 00:46:36 - [Epoch=1 | Step=51600/334762] loss=14.0220
05-Feb-26 00:47:30 - [Epoch=1 | Step=51700/334762] loss=21.5570
05-Feb-26 00:48:23 - [Epoch=1 | Step=51800/334762] loss=13.6174
05-Feb-26 00:49:16 - [Epoch=1 | Step=51900/334762] loss=12.0507
05-Feb-26 00:50:09 - [Epoch=1 | Step=52000/334762] loss=11.9233
05-Feb-26 00:51:02 - [Epoch=1 | Step=52100/334762] loss=12.8400
05-Feb-26 00:51:55 - [Epoch=1 | Step=52200/334762] loss=12.9590
05-Feb-26 00:52:47 - [Epoch=1 | Step=52300/334762] loss=13.7236
05-Feb-26 00:53:40 - [Epoch=1 | Step=52400/334762] loss=11.9207
05-Feb-26 00:54:33 - [Epoch=1 | Step=52500/334762] loss=12.7800
05-Feb-26 00:55:26 - [Epoch=1 | Step=52600/334762] loss=10.1575
05-Feb-26 00:56:19 - [Epoch=1 | Step=52700/334762] loss=7.9164
05-Feb-26 00:57:12 - [Epoch=1 | Step=52800/334762] loss=7.8296
05-Feb-26 00:58:04 - [Epoch=1 | Step=52900/334762] loss=9.0236
05-Feb-26 00:58:58 - [Epoch=1 | Step=53000/334762] loss=7.2642
05-Feb-26 00:59:50 - [Epoch=1 | Step=53100/334762] loss=7.2183
05-Feb-26 01:00:43 - [Epoch=1 | Step=53200/334762] loss=7.5350
05-Feb-26 01:01:37 - [Epoch=1 | Step=53300/334762] loss=7.2341
05-Feb-26 01:02:30 - [Epoch=1 | Step=53400/334762] loss=6.5043
05-Feb-26 01:03:23 - [Epoch=1 | Step=53500/334762] loss=10.6008
05-Feb-26 01:04:15 - [Epoch=1 | Step=53600/334762] loss=9.2739
05-Feb-26 01:05:08 - [Epoch=1 | Step=53700/334762] loss=8.7012
05-Feb-26 01:06:01 - [Epoch=1 | Step=53800/334762] loss=8.1890
05-Feb-26 01:06:53 - [Epoch=1 | Step=53900/334762] loss=9.8030
05-Feb-26 01:07:47 - [Epoch=1 | Step=54000/334762] loss=11.2324
05-Feb-26 01:08:40 - [Epoch=1 | Step=54100/334762] loss=8.1425
05-Feb-26 01:09:34 - [Epoch=1 | Step=54200/334762] loss=10.9637
05-Feb-26 01:10:28 - [Epoch=1 | Step=54300/334762] loss=8.9470
05-Feb-26 01:11:22 - [Epoch=1 | Step=54400/334762] loss=8.8996
05-Feb-26 01:12:16 - [Epoch=1 | Step=54500/334762] loss=15.5792
05-Feb-26 01:13:10 - [Epoch=1 | Step=54600/334762] loss=8.0120
05-Feb-26 01:14:04 - [Epoch=1 | Step=54700/334762] loss=8.7209
05-Feb-26 01:14:57 - [Epoch=1 | Step=54800/334762] loss=11.7563
05-Feb-26 01:15:51 - [Epoch=1 | Step=54900/334762] loss=10.2916
05-Feb-26 01:16:45 - [Epoch=1 | Step=55000/334762] loss=10.3362
05-Feb-26 01:17:38 - [Epoch=1 | Step=55100/334762] loss=8.3930
05-Feb-26 01:18:31 - [Epoch=1 | Step=55200/334762] loss=11.7947
05-Feb-26 01:19:24 - [Epoch=1 | Step=55300/334762] loss=9.6232
05-Feb-26 01:20:18 - [Epoch=1 | Step=55400/334762] loss=10.0741
05-Feb-26 01:21:12 - [Epoch=1 | Step=55500/334762] loss=11.2021
05-Feb-26 01:22:06 - [Epoch=1 | Step=55600/334762] loss=12.5898
05-Feb-26 01:22:59 - [Epoch=1 | Step=55700/334762] loss=11.1226
05-Feb-26 01:23:52 - [Epoch=1 | Step=55800/334762] loss=9.9686
05-Feb-26 01:24:45 - [Epoch=1 | Step=55900/334762] loss=7.8348
05-Feb-26 01:25:39 - [Epoch=1 | Step=56000/334762] loss=8.9946
05-Feb-26 01:26:32 - [Epoch=1 | Step=56100/334762] loss=10.8026
05-Feb-26 01:27:25 - [Epoch=1 | Step=56200/334762] loss=8.7079
05-Feb-26 01:28:19 - [Epoch=1 | Step=56300/334762] loss=8.2696
05-Feb-26 01:29:12 - [Epoch=1 | Step=56400/334762] loss=8.2443
05-Feb-26 01:30:06 - [Epoch=1 | Step=56500/334762] loss=9.4494
05-Feb-26 01:31:00 - [Epoch=1 | Step=56600/334762] loss=10.2859
05-Feb-26 01:31:54 - [Epoch=1 | Step=56700/334762] loss=9.3457
05-Feb-26 01:32:47 - [Epoch=1 | Step=56800/334762] loss=12.4465
05-Feb-26 01:33:41 - [Epoch=1 | Step=56900/334762] loss=10.7219
05-Feb-26 01:34:34 - [Epoch=1 | Step=57000/334762] loss=15.2228
05-Feb-26 01:35:28 - [Epoch=1 | Step=57100/334762] loss=7.3264
05-Feb-26 01:36:22 - [Epoch=1 | Step=57200/334762] loss=10.2312
05-Feb-26 01:37:15 - [Epoch=1 | Step=57300/334762] loss=12.6032
05-Feb-26 01:38:08 - [Epoch=1 | Step=57400/334762] loss=9.3920
05-Feb-26 01:39:02 - [Epoch=1 | Step=57500/334762] loss=10.9960
05-Feb-26 01:39:55 - [Epoch=1 | Step=57600/334762] loss=13.2206
05-Feb-26 01:40:49 - [Epoch=1 | Step=57700/334762] loss=13.3028
05-Feb-26 01:41:42 - [Epoch=1 | Step=57800/334762] loss=12.7747
05-Feb-26 01:42:35 - [Epoch=1 | Step=57900/334762] loss=17.7096
05-Feb-26 01:43:28 - [Epoch=1 | Step=58000/334762] loss=11.8117
05-Feb-26 01:44:22 - [Epoch=1 | Step=58100/334762] loss=13.3772
05-Feb-26 01:45:15 - [Epoch=1 | Step=58200/334762] loss=12.2306
05-Feb-26 01:46:08 - [Epoch=1 | Step=58300/334762] loss=13.7905
05-Feb-26 01:47:01 - [Epoch=1 | Step=58400/334762] loss=11.4755
05-Feb-26 01:47:54 - [Epoch=1 | Step=58500/334762] loss=11.4035
05-Feb-26 01:48:48 - [Epoch=1 | Step=58600/334762] loss=7.7790
05-Feb-26 01:49:41 - [Epoch=1 | Step=58700/334762] loss=10.7588
05-Feb-26 01:50:34 - [Epoch=1 | Step=58800/334762] loss=10.5799
05-Feb-26 01:51:27 - [Epoch=1 | Step=58900/334762] loss=10.5848
05-Feb-26 01:52:20 - [Epoch=1 | Step=59000/334762] loss=10.6543
05-Feb-26 01:53:12 - [Epoch=1 | Step=59100/334762] loss=9.5902
05-Feb-26 01:54:05 - [Epoch=1 | Step=59200/334762] loss=7.7980
05-Feb-26 01:54:57 - [Epoch=1 | Step=59300/334762] loss=8.9770
05-Feb-26 01:55:50 - [Epoch=1 | Step=59400/334762] loss=9.2595
05-Feb-26 01:56:42 - [Epoch=1 | Step=59500/334762] loss=7.0231
05-Feb-26 01:57:34 - [Epoch=1 | Step=59600/334762] loss=7.8411
05-Feb-26 01:58:27 - [Epoch=1 | Step=59700/334762] loss=9.5190
05-Feb-26 01:59:19 - [Epoch=1 | Step=59800/334762] loss=11.3423
05-Feb-26 02:00:11 - [Epoch=1 | Step=59900/334762] loss=12.7526
05-Feb-26 02:01:03 - [Epoch=1 | Step=60000/334762] loss=12.8790
05-Feb-26 02:01:55 - [Epoch=1 | Step=60100/334762] loss=10.0232
05-Feb-26 02:02:47 - [Epoch=1 | Step=60200/334762] loss=10.5197
05-Feb-26 02:03:39 - [Epoch=1 | Step=60300/334762] loss=8.2444
05-Feb-26 02:04:32 - [Epoch=1 | Step=60400/334762] loss=7.3899
05-Feb-26 02:05:24 - [Epoch=1 | Step=60500/334762] loss=6.4548
05-Feb-26 02:06:16 - [Epoch=1 | Step=60600/334762] loss=7.1226
05-Feb-26 02:07:08 - [Epoch=1 | Step=60700/334762] loss=6.8337
05-Feb-26 02:08:00 - [Epoch=1 | Step=60800/334762] loss=8.9199
05-Feb-26 02:08:53 - [Epoch=1 | Step=60900/334762] loss=6.6705
05-Feb-26 02:09:46 - [Epoch=1 | Step=61000/334762] loss=7.0668
05-Feb-26 02:10:38 - [Epoch=1 | Step=61100/334762] loss=6.4041
05-Feb-26 02:11:31 - [Epoch=1 | Step=61200/334762] loss=7.5970
05-Feb-26 02:12:23 - [Epoch=1 | Step=61300/334762] loss=6.0036
05-Feb-26 02:13:16 - [Epoch=1 | Step=61400/334762] loss=5.5812
05-Feb-26 02:14:09 - [Epoch=1 | Step=61500/334762] loss=7.3620
05-Feb-26 02:15:03 - [Epoch=1 | Step=61600/334762] loss=7.0338
05-Feb-26 02:15:56 - [Epoch=1 | Step=61700/334762] loss=5.1671
05-Feb-26 02:16:49 - [Epoch=1 | Step=61800/334762] loss=5.9495
05-Feb-26 02:17:42 - [Epoch=1 | Step=61900/334762] loss=5.3536
05-Feb-26 02:18:36 - [Epoch=1 | Step=62000/334762] loss=5.1223
05-Feb-26 02:19:29 - [Epoch=1 | Step=62100/334762] loss=5.5171
05-Feb-26 02:20:23 - [Epoch=1 | Step=62200/334762] loss=5.8442
05-Feb-26 02:21:16 - [Epoch=1 | Step=62300/334762] loss=5.4269
05-Feb-26 02:22:10 - [Epoch=1 | Step=62400/334762] loss=4.7658
05-Feb-26 02:23:02 - [Epoch=1 | Step=62500/334762] loss=6.0559
05-Feb-26 02:23:56 - [Epoch=1 | Step=62600/334762] loss=7.3124
05-Feb-26 02:24:49 - [Epoch=1 | Step=62700/334762] loss=7.8798
05-Feb-26 02:25:41 - [Epoch=1 | Step=62800/334762] loss=7.8704
05-Feb-26 02:26:34 - [Epoch=1 | Step=62900/334762] loss=9.2672
05-Feb-26 02:27:27 - [Epoch=1 | Step=63000/334762] loss=8.9442
05-Feb-26 02:28:20 - [Epoch=1 | Step=63100/334762] loss=8.1347
05-Feb-26 02:29:13 - [Epoch=1 | Step=63200/334762] loss=9.3610
05-Feb-26 02:30:05 - [Epoch=1 | Step=63300/334762] loss=10.3203
05-Feb-26 02:30:59 - [Epoch=1 | Step=63400/334762] loss=9.4273
05-Feb-26 02:31:52 - [Epoch=1 | Step=63500/334762] loss=11.2534
05-Feb-26 02:32:45 - [Epoch=1 | Step=63600/334762] loss=10.4998
05-Feb-26 02:33:37 - [Epoch=1 | Step=63700/334762] loss=11.8463
05-Feb-26 02:34:30 - [Epoch=1 | Step=63800/334762] loss=11.0083
05-Feb-26 02:35:23 - [Epoch=1 | Step=63900/334762] loss=11.5203
05-Feb-26 02:36:17 - [Epoch=1 | Step=64000/334762] loss=13.8889
05-Feb-26 02:37:11 - [Epoch=1 | Step=64100/334762] loss=10.1386
05-Feb-26 02:38:03 - [Epoch=1 | Step=64200/334762] loss=8.3542
05-Feb-26 02:38:56 - [Epoch=1 | Step=64300/334762] loss=8.1323
05-Feb-26 02:39:49 - [Epoch=1 | Step=64400/334762] loss=8.6187
05-Feb-26 02:40:42 - [Epoch=1 | Step=64500/334762] loss=10.2056
05-Feb-26 02:41:35 - [Epoch=1 | Step=64600/334762] loss=9.7364
05-Feb-26 02:42:29 - [Epoch=1 | Step=64700/334762] loss=10.1074
05-Feb-26 02:43:23 - [Epoch=1 | Step=64800/334762] loss=7.1651
05-Feb-26 02:44:15 - [Epoch=1 | Step=64900/334762] loss=8.3378
05-Feb-26 02:45:09 - [Epoch=1 | Step=65000/334762] loss=8.6978
05-Feb-26 02:46:03 - [Epoch=1 | Step=65100/334762] loss=6.3140
05-Feb-26 02:46:57 - [Epoch=1 | Step=65200/334762] loss=6.4188
05-Feb-26 02:47:51 - [Epoch=1 | Step=65300/334762] loss=6.5380
05-Feb-26 02:48:44 - [Epoch=1 | Step=65400/334762] loss=6.6828
05-Feb-26 02:49:39 - [Epoch=1 | Step=65500/334762] loss=9.4548
05-Feb-26 02:50:33 - [Epoch=1 | Step=65600/334762] loss=8.0745
05-Feb-26 02:51:26 - [Epoch=1 | Step=65700/334762] loss=7.4127
05-Feb-26 02:52:20 - [Epoch=1 | Step=65800/334762] loss=8.4781
05-Feb-26 02:53:12 - [Epoch=1 | Step=65900/334762] loss=5.3164
05-Feb-26 02:54:05 - [Epoch=1 | Step=66000/334762] loss=7.9939
05-Feb-26 02:54:58 - [Epoch=1 | Step=66100/334762] loss=7.6158
05-Feb-26 02:55:51 - [Epoch=1 | Step=66200/334762] loss=6.6963
05-Feb-26 02:56:44 - [Epoch=1 | Step=66300/334762] loss=6.8125
05-Feb-26 02:57:37 - [Epoch=1 | Step=66400/334762] loss=5.8984
05-Feb-26 02:58:29 - [Epoch=1 | Step=66500/334762] loss=5.2031
05-Feb-26 02:59:21 - [Epoch=1 | Step=66600/334762] loss=5.4830
05-Feb-26 03:00:14 - [Epoch=1 | Step=66700/334762] loss=4.6156
05-Feb-26 03:01:07 - [Epoch=1 | Step=66800/334762] loss=4.6766
05-Feb-26 03:02:00 - [Epoch=1 | Step=66900/334762] loss=5.4993
05-Feb-26 03:02:53 - [Epoch=1 | Step=67000/334762] loss=5.3559
05-Feb-26 03:03:46 - [Epoch=1 | Step=67100/334762] loss=7.4453
05-Feb-26 03:04:38 - [Epoch=1 | Step=67200/334762] loss=5.2019
05-Feb-26 03:05:31 - [Epoch=1 | Step=67300/334762] loss=5.8273
05-Feb-26 03:06:24 - [Epoch=1 | Step=67400/334762] loss=6.2898
05-Feb-26 03:07:16 - [Epoch=1 | Step=67500/334762] loss=5.6513
05-Feb-26 03:08:09 - [Epoch=1 | Step=67600/334762] loss=6.6938
05-Feb-26 03:09:02 - [Epoch=1 | Step=67700/334762] loss=7.2257
05-Feb-26 03:09:54 - [Epoch=1 | Step=67800/334762] loss=11.5202
05-Feb-26 03:10:47 - [Epoch=1 | Step=67900/334762] loss=8.5967
05-Feb-26 03:11:39 - [Epoch=1 | Step=68000/334762] loss=8.3424
05-Feb-26 03:12:31 - [Epoch=1 | Step=68100/334762] loss=9.6069
05-Feb-26 03:13:23 - [Epoch=1 | Step=68200/334762] loss=9.0397
05-Feb-26 03:14:15 - [Epoch=1 | Step=68300/334762] loss=9.9430
05-Feb-26 03:15:07 - [Epoch=1 | Step=68400/334762] loss=12.4321
05-Feb-26 03:15:59 - [Epoch=1 | Step=68500/334762] loss=11.0371
05-Feb-26 03:16:52 - [Epoch=1 | Step=68600/334762] loss=12.5986
05-Feb-26 03:17:44 - [Epoch=1 | Step=68700/334762] loss=11.0097
05-Feb-26 03:18:36 - [Epoch=1 | Step=68800/334762] loss=10.4029
05-Feb-26 03:19:28 - [Epoch=1 | Step=68900/334762] loss=9.6915
05-Feb-26 03:20:20 - [Epoch=1 | Step=69000/334762] loss=12.3030
05-Feb-26 03:21:11 - [Epoch=1 | Step=69100/334762] loss=8.6403
05-Feb-26 03:22:03 - [Epoch=1 | Step=69200/334762] loss=10.8485
05-Feb-26 03:22:55 - [Epoch=1 | Step=69300/334762] loss=10.1332
05-Feb-26 03:23:46 - [Epoch=1 | Step=69400/334762] loss=11.2030
05-Feb-26 03:24:37 - [Epoch=1 | Step=69500/334762] loss=10.5186
05-Feb-26 03:25:29 - [Epoch=1 | Step=69600/334762] loss=9.4295
05-Feb-26 03:26:20 - [Epoch=1 | Step=69700/334762] loss=11.2846
05-Feb-26 03:27:12 - [Epoch=1 | Step=69800/334762] loss=6.9344
05-Feb-26 03:28:04 - [Epoch=1 | Step=69900/334762] loss=8.4969
05-Feb-26 03:28:55 - [Epoch=1 | Step=70000/334762] loss=7.7395
05-Feb-26 03:29:46 - [Epoch=1 | Step=70100/334762] loss=6.3236
05-Feb-26 03:30:38 - [Epoch=1 | Step=70200/334762] loss=7.2329
05-Feb-26 03:31:29 - [Epoch=1 | Step=70300/334762] loss=9.0302
05-Feb-26 03:32:21 - [Epoch=1 | Step=70400/334762] loss=7.0698
05-Feb-26 03:33:12 - [Epoch=1 | Step=70500/334762] loss=9.6909
05-Feb-26 03:34:05 - [Epoch=1 | Step=70600/334762] loss=8.7652
05-Feb-26 03:34:57 - [Epoch=1 | Step=70700/334762] loss=9.2810
05-Feb-26 03:35:48 - [Epoch=1 | Step=70800/334762] loss=8.3891
05-Feb-26 03:36:40 - [Epoch=1 | Step=70900/334762] loss=10.8197
05-Feb-26 03:37:33 - [Epoch=1 | Step=71000/334762] loss=6.1523
05-Feb-26 03:38:24 - [Epoch=1 | Step=71100/334762] loss=6.5086
05-Feb-26 03:39:15 - [Epoch=1 | Step=71200/334762] loss=8.6319
05-Feb-26 03:40:07 - [Epoch=1 | Step=71300/334762] loss=4.9560
05-Feb-26 03:40:59 - [Epoch=1 | Step=71400/334762] loss=6.0693
05-Feb-26 03:41:51 - [Epoch=1 | Step=71500/334762] loss=5.9398
05-Feb-26 03:42:43 - [Epoch=1 | Step=71600/334762] loss=6.1317
05-Feb-26 03:43:35 - [Epoch=1 | Step=71700/334762] loss=5.6207
05-Feb-26 03:44:26 - [Epoch=1 | Step=71800/334762] loss=4.9534
05-Feb-26 03:45:19 - [Epoch=1 | Step=71900/334762] loss=5.4813
05-Feb-26 03:46:10 - [Epoch=1 | Step=72000/334762] loss=6.1496
05-Feb-26 03:47:01 - [Epoch=1 | Step=72100/334762] loss=6.6304
05-Feb-26 03:47:52 - [Epoch=1 | Step=72200/334762] loss=7.1594
05-Feb-26 03:48:44 - [Epoch=1 | Step=72300/334762] loss=6.2963
05-Feb-26 03:49:35 - [Epoch=1 | Step=72400/334762] loss=6.3740
05-Feb-26 03:50:28 - [Epoch=1 | Step=72500/334762] loss=4.9178
05-Feb-26 03:51:20 - [Epoch=1 | Step=72600/334762] loss=5.9803
05-Feb-26 03:52:11 - [Epoch=1 | Step=72700/334762] loss=5.3160
05-Feb-26 03:53:03 - [Epoch=1 | Step=72800/334762] loss=5.5308
05-Feb-26 03:53:54 - [Epoch=1 | Step=72900/334762] loss=6.7248
05-Feb-26 03:54:47 - [Epoch=1 | Step=73000/334762] loss=9.9267
05-Feb-26 03:55:38 - [Epoch=1 | Step=73100/334762] loss=10.4190
05-Feb-26 03:56:30 - [Epoch=1 | Step=73200/334762] loss=8.7911
05-Feb-26 03:57:22 - [Epoch=1 | Step=73300/334762] loss=10.1316
05-Feb-26 03:58:14 - [Epoch=1 | Step=73400/334762] loss=6.9546
05-Feb-26 03:59:06 - [Epoch=1 | Step=73500/334762] loss=8.7200
05-Feb-26 03:59:58 - [Epoch=1 | Step=73600/334762] loss=9.0016
05-Feb-26 04:00:50 - [Epoch=1 | Step=73700/334762] loss=8.5752
05-Feb-26 04:01:42 - [Epoch=1 | Step=73800/334762] loss=6.9217
05-Feb-26 04:02:34 - [Epoch=1 | Step=73900/334762] loss=8.2472
05-Feb-26 04:03:26 - [Epoch=1 | Step=74000/334762] loss=9.2151
05-Feb-26 04:04:18 - [Epoch=1 | Step=74100/334762] loss=5.8299
05-Feb-26 04:05:10 - [Epoch=1 | Step=74200/334762] loss=7.0410
05-Feb-26 04:06:03 - [Epoch=1 | Step=74300/334762] loss=5.3529
05-Feb-26 04:06:54 - [Epoch=1 | Step=74400/334762] loss=6.8205
05-Feb-26 04:07:46 - [Epoch=1 | Step=74500/334762] loss=7.5692
05-Feb-26 04:08:38 - [Epoch=1 | Step=74600/334762] loss=9.5058
05-Feb-26 04:09:30 - [Epoch=1 | Step=74700/334762] loss=10.4975
05-Feb-26 04:10:22 - [Epoch=1 | Step=74800/334762] loss=8.3764
05-Feb-26 04:11:14 - [Epoch=1 | Step=74900/334762] loss=9.6829
05-Feb-26 04:12:06 - [Epoch=1 | Step=75000/334762] loss=7.3130
05-Feb-26 04:12:57 - [Epoch=1 | Step=75100/334762] loss=8.3800
05-Feb-26 04:13:49 - [Epoch=1 | Step=75200/334762] loss=11.1188
05-Feb-26 04:14:41 - [Epoch=1 | Step=75300/334762] loss=10.7552
05-Feb-26 04:15:34 - [Epoch=1 | Step=75400/334762] loss=16.3161
05-Feb-26 04:16:26 - [Epoch=1 | Step=75500/334762] loss=10.0660
05-Feb-26 04:17:18 - [Epoch=1 | Step=75600/334762] loss=10.1505
05-Feb-26 04:18:10 - [Epoch=1 | Step=75700/334762] loss=9.7930
05-Feb-26 04:19:01 - [Epoch=1 | Step=75800/334762] loss=6.8780
05-Feb-26 04:19:54 - [Epoch=1 | Step=75900/334762] loss=9.1784
05-Feb-26 04:20:46 - [Epoch=1 | Step=76000/334762] loss=8.0785
05-Feb-26 04:21:38 - [Epoch=1 | Step=76100/334762] loss=7.8659
05-Feb-26 04:22:30 - [Epoch=1 | Step=76200/334762] loss=7.4010
05-Feb-26 04:23:22 - [Epoch=1 | Step=76300/334762] loss=6.4727
05-Feb-26 04:24:13 - [Epoch=1 | Step=76400/334762] loss=7.4525
05-Feb-26 04:25:05 - [Epoch=1 | Step=76500/334762] loss=6.9251
05-Feb-26 04:25:57 - [Epoch=1 | Step=76600/334762] loss=8.9535
05-Feb-26 04:26:49 - [Epoch=1 | Step=76700/334762] loss=6.5228
05-Feb-26 04:27:41 - [Epoch=1 | Step=76800/334762] loss=7.0501
05-Feb-26 04:28:32 - [Epoch=1 | Step=76900/334762] loss=7.3789
05-Feb-26 04:29:24 - [Epoch=1 | Step=77000/334762] loss=6.1116
05-Feb-26 04:30:16 - [Epoch=1 | Step=77100/334762] loss=6.5863
05-Feb-26 04:31:08 - [Epoch=1 | Step=77200/334762] loss=4.6183
05-Feb-26 04:32:00 - [Epoch=1 | Step=77300/334762] loss=5.7195
05-Feb-26 04:32:51 - [Epoch=1 | Step=77400/334762] loss=5.9390
05-Feb-26 04:33:43 - [Epoch=1 | Step=77500/334762] loss=5.3282
05-Feb-26 04:34:35 - [Epoch=1 | Step=77600/334762] loss=4.2529
05-Feb-26 04:35:27 - [Epoch=1 | Step=77700/334762] loss=4.8768
05-Feb-26 04:36:20 - [Epoch=1 | Step=77800/334762] loss=4.0435
05-Feb-26 04:37:11 - [Epoch=1 | Step=77900/334762] loss=4.2132
05-Feb-26 04:38:03 - [Epoch=1 | Step=78000/334762] loss=4.9149
05-Feb-26 04:38:55 - [Epoch=1 | Step=78100/334762] loss=5.4132
05-Feb-26 04:39:47 - [Epoch=1 | Step=78200/334762] loss=7.2623
05-Feb-26 04:40:39 - [Epoch=1 | Step=78300/334762] loss=6.2544
05-Feb-26 04:41:31 - [Epoch=1 | Step=78400/334762] loss=8.7556
05-Feb-26 04:42:22 - [Epoch=1 | Step=78500/334762] loss=6.9129
05-Feb-26 04:43:14 - [Epoch=1 | Step=78600/334762] loss=9.6706
05-Feb-26 04:44:06 - [Epoch=1 | Step=78700/334762] loss=8.0039
05-Feb-26 04:44:58 - [Epoch=1 | Step=78800/334762] loss=8.1494
05-Feb-26 04:45:50 - [Epoch=1 | Step=78900/334762] loss=7.1847
05-Feb-26 04:46:41 - [Epoch=1 | Step=79000/334762] loss=5.6798
05-Feb-26 04:47:33 - [Epoch=1 | Step=79100/334762] loss=6.2039
05-Feb-26 04:48:25 - [Epoch=1 | Step=79200/334762] loss=8.3882
05-Feb-26 04:49:17 - [Epoch=1 | Step=79300/334762] loss=8.8358
05-Feb-26 04:50:09 - [Epoch=1 | Step=79400/334762] loss=8.3698
05-Feb-26 04:51:01 - [Epoch=1 | Step=79500/334762] loss=7.8717
05-Feb-26 04:51:53 - [Epoch=1 | Step=79600/334762] loss=6.0429
05-Feb-26 04:52:45 - [Epoch=1 | Step=79700/334762] loss=9.7584
05-Feb-26 04:53:37 - [Epoch=1 | Step=79800/334762] loss=8.7319
05-Feb-26 04:54:29 - [Epoch=1 | Step=79900/334762] loss=7.2349
05-Feb-26 04:55:20 - [Epoch=1 | Step=80000/334762] loss=9.6114
05-Feb-26 04:56:12 - [Epoch=1 | Step=80100/334762] loss=9.0877
05-Feb-26 04:57:04 - [Epoch=1 | Step=80200/334762] loss=7.9100
05-Feb-26 04:57:55 - [Epoch=1 | Step=80300/334762] loss=8.8572
05-Feb-26 04:58:47 - [Epoch=1 | Step=80400/334762] loss=9.8624
05-Feb-26 04:59:39 - [Epoch=1 | Step=80500/334762] loss=9.2033
05-Feb-26 05:00:30 - [Epoch=1 | Step=80600/334762] loss=8.7627
05-Feb-26 05:01:22 - [Epoch=1 | Step=80700/334762] loss=8.0446
05-Feb-26 05:02:13 - [Epoch=1 | Step=80800/334762] loss=9.8137
05-Feb-26 05:03:05 - [Epoch=1 | Step=80900/334762] loss=9.7763
05-Feb-26 05:03:57 - [Epoch=1 | Step=81000/334762] loss=8.0882
05-Feb-26 05:04:48 - [Epoch=1 | Step=81100/334762] loss=6.3865
05-Feb-26 05:05:40 - [Epoch=1 | Step=81200/334762] loss=7.6067
05-Feb-26 05:06:32 - [Epoch=1 | Step=81300/334762] loss=5.6713
05-Feb-26 05:07:24 - [Epoch=1 | Step=81400/334762] loss=7.7107
05-Feb-26 05:08:16 - [Epoch=1 | Step=81500/334762] loss=5.6715
05-Feb-26 05:09:07 - [Epoch=1 | Step=81600/334762] loss=5.9338
05-Feb-26 05:09:59 - [Epoch=1 | Step=81700/334762] loss=5.4444
05-Feb-26 05:10:50 - [Epoch=1 | Step=81800/334762] loss=6.8192
05-Feb-26 05:11:41 - [Epoch=1 | Step=81900/334762] loss=5.8735
05-Feb-26 05:12:32 - [Epoch=1 | Step=82000/334762] loss=9.6243
05-Feb-26 05:13:23 - [Epoch=1 | Step=82100/334762] loss=9.4942
05-Feb-26 05:14:15 - [Epoch=1 | Step=82200/334762] loss=9.8076
05-Feb-26 05:15:06 - [Epoch=1 | Step=82300/334762] loss=6.7666
05-Feb-26 05:15:57 - [Epoch=1 | Step=82400/334762] loss=6.6585
05-Feb-26 05:16:49 - [Epoch=1 | Step=82500/334762] loss=7.5113
05-Feb-26 05:17:40 - [Epoch=1 | Step=82600/334762] loss=7.6853
05-Feb-26 05:18:32 - [Epoch=1 | Step=82700/334762] loss=8.2729
05-Feb-26 05:19:23 - [Epoch=1 | Step=82800/334762] loss=6.5004
05-Feb-26 05:20:15 - [Epoch=1 | Step=82900/334762] loss=7.8363
05-Feb-26 05:21:07 - [Epoch=1 | Step=83000/334762] loss=10.5879
05-Feb-26 05:21:58 - [Epoch=1 | Step=83100/334762] loss=10.0698
05-Feb-26 05:22:49 - [Epoch=1 | Step=83200/334762] loss=9.9321
05-Feb-26 05:23:40 - [Epoch=1 | Step=83300/334762] loss=7.4634
05-Feb-26 05:24:32 - [Epoch=1 | Step=83400/334762] loss=6.3741
05-Feb-26 05:25:23 - [Epoch=1 | Step=83500/334762] loss=7.1954
05-Feb-26 05:26:15 - [Epoch=1 | Step=83600/334762] loss=6.0742
05-Feb-26 05:27:07 - [Epoch=1 | Step=83700/334762] loss=5.8013
05-Feb-26 05:27:58 - [Epoch=1 | Step=83800/334762] loss=5.2831
05-Feb-26 05:28:49 - [Epoch=1 | Step=83900/334762] loss=6.1008
05-Feb-26 05:29:41 - [Epoch=1 | Step=84000/334762] loss=7.2697
05-Feb-26 05:30:32 - [Epoch=1 | Step=84100/334762] loss=8.3840
05-Feb-26 05:31:24 - [Epoch=1 | Step=84200/334762] loss=7.9947
05-Feb-26 05:32:15 - [Epoch=1 | Step=84300/334762] loss=7.8238
05-Feb-26 05:33:06 - [Epoch=1 | Step=84400/334762] loss=6.1742
05-Feb-26 05:33:57 - [Epoch=1 | Step=84500/334762] loss=5.8547
05-Feb-26 05:34:48 - [Epoch=1 | Step=84600/334762] loss=5.6602
05-Feb-26 05:35:40 - [Epoch=1 | Step=84700/334762] loss=4.1566
05-Feb-26 05:36:31 - [Epoch=1 | Step=84800/334762] loss=6.1604
05-Feb-26 05:37:23 - [Epoch=1 | Step=84900/334762] loss=5.5881
05-Feb-26 05:38:15 - [Epoch=1 | Step=85000/334762] loss=5.1473
05-Feb-26 05:39:06 - [Epoch=1 | Step=85100/334762] loss=4.1868
05-Feb-26 05:39:57 - [Epoch=1 | Step=85200/334762] loss=5.3525
05-Feb-26 05:40:49 - [Epoch=1 | Step=85300/334762] loss=4.8418
05-Feb-26 05:41:40 - [Epoch=1 | Step=85400/334762] loss=5.2440
05-Feb-26 05:42:32 - [Epoch=1 | Step=85500/334762] loss=4.5660
05-Feb-26 05:43:23 - [Epoch=1 | Step=85600/334762] loss=4.7400
05-Feb-26 05:44:14 - [Epoch=1 | Step=85700/334762] loss=4.9595
05-Feb-26 05:45:05 - [Epoch=1 | Step=85800/334762] loss=6.5977
05-Feb-26 05:45:56 - [Epoch=1 | Step=85900/334762] loss=4.7690
05-Feb-26 05:46:48 - [Epoch=1 | Step=86000/334762] loss=4.5148
05-Feb-26 05:47:39 - [Epoch=1 | Step=86100/334762] loss=5.5710
05-Feb-26 05:48:30 - [Epoch=1 | Step=86200/334762] loss=7.1908
05-Feb-26 05:49:21 - [Epoch=1 | Step=86300/334762] loss=5.9191
05-Feb-26 05:50:12 - [Epoch=1 | Step=86400/334762] loss=6.1344
05-Feb-26 05:51:03 - [Epoch=1 | Step=86500/334762] loss=4.3314
05-Feb-26 05:51:54 - [Epoch=1 | Step=86600/334762] loss=5.3125
05-Feb-26 05:52:45 - [Epoch=1 | Step=86700/334762] loss=3.8036
05-Feb-26 05:53:37 - [Epoch=1 | Step=86800/334762] loss=5.7096
05-Feb-26 05:54:28 - [Epoch=1 | Step=86900/334762] loss=4.8403
05-Feb-26 05:55:18 - [Epoch=1 | Step=87000/334762] loss=5.3377
05-Feb-26 05:56:10 - [Epoch=1 | Step=87100/334762] loss=4.5457
05-Feb-26 05:57:01 - [Epoch=1 | Step=87200/334762] loss=4.2023
05-Feb-26 05:57:52 - [Epoch=1 | Step=87300/334762] loss=5.7896
05-Feb-26 05:58:43 - [Epoch=1 | Step=87400/334762] loss=3.9569
05-Feb-26 05:59:35 - [Epoch=1 | Step=87500/334762] loss=4.7280
05-Feb-26 06:00:25 - [Epoch=1 | Step=87600/334762] loss=7.1901
05-Feb-26 06:01:17 - [Epoch=1 | Step=87700/334762] loss=4.8155
05-Feb-26 06:02:08 - [Epoch=1 | Step=87800/334762] loss=3.8310
05-Feb-26 06:03:00 - [Epoch=1 | Step=87900/334762] loss=5.6103
05-Feb-26 06:03:51 - [Epoch=1 | Step=88000/334762] loss=3.7305
05-Feb-26 06:04:43 - [Epoch=1 | Step=88100/334762] loss=5.4461
05-Feb-26 06:05:34 - [Epoch=1 | Step=88200/334762] loss=5.3993
05-Feb-26 06:06:26 - [Epoch=1 | Step=88300/334762] loss=4.0366
05-Feb-26 06:07:18 - [Epoch=1 | Step=88400/334762] loss=7.4060
05-Feb-26 06:08:09 - [Epoch=1 | Step=88500/334762] loss=4.9313
05-Feb-26 06:09:00 - [Epoch=1 | Step=88600/334762] loss=3.7303
05-Feb-26 06:09:52 - [Epoch=1 | Step=88700/334762] loss=5.4935
05-Feb-26 06:10:44 - [Epoch=1 | Step=88800/334762] loss=4.1083
05-Feb-26 06:11:35 - [Epoch=1 | Step=88900/334762] loss=3.2021
05-Feb-26 06:12:26 - [Epoch=1 | Step=89000/334762] loss=4.9815
05-Feb-26 06:13:18 - [Epoch=1 | Step=89100/334762] loss=6.2596
05-Feb-26 06:14:10 - [Epoch=1 | Step=89200/334762] loss=4.7625
05-Feb-26 06:15:01 - [Epoch=1 | Step=89300/334762] loss=5.5510
05-Feb-26 06:15:53 - [Epoch=1 | Step=89400/334762] loss=5.3402
05-Feb-26 06:16:44 - [Epoch=1 | Step=89500/334762] loss=4.8619
05-Feb-26 06:17:35 - [Epoch=1 | Step=89600/334762] loss=5.3580
05-Feb-26 06:18:26 - [Epoch=1 | Step=89700/334762] loss=4.6004
05-Feb-26 06:19:17 - [Epoch=1 | Step=89800/334762] loss=4.1074
05-Feb-26 06:20:07 - [Epoch=1 | Step=89900/334762] loss=4.5932
05-Feb-26 06:20:58 - [Epoch=1 | Step=90000/334762] loss=3.9561
05-Feb-26 06:21:49 - [Epoch=1 | Step=90100/334762] loss=4.2626
05-Feb-26 06:22:39 - [Epoch=1 | Step=90200/334762] loss=6.8065
05-Feb-26 06:23:29 - [Epoch=1 | Step=90300/334762] loss=4.2344
05-Feb-26 06:24:20 - [Epoch=1 | Step=90400/334762] loss=4.9877
05-Feb-26 06:25:10 - [Epoch=1 | Step=90500/334762] loss=4.4802
05-Feb-26 06:26:01 - [Epoch=1 | Step=90600/334762] loss=5.1785
05-Feb-26 06:26:52 - [Epoch=1 | Step=90700/334762] loss=4.6278
05-Feb-26 06:27:43 - [Epoch=1 | Step=90800/334762] loss=5.3037
05-Feb-26 06:28:33 - [Epoch=1 | Step=90900/334762] loss=5.6421
05-Feb-26 06:29:24 - [Epoch=1 | Step=91000/334762] loss=6.6610
05-Feb-26 06:30:15 - [Epoch=1 | Step=91100/334762] loss=8.1016
05-Feb-26 06:31:05 - [Epoch=1 | Step=91200/334762] loss=6.7019
05-Feb-26 06:31:56 - [Epoch=1 | Step=91300/334762] loss=7.5351
05-Feb-26 06:32:46 - [Epoch=1 | Step=91400/334762] loss=6.8827
05-Feb-26 06:33:36 - [Epoch=1 | Step=91500/334762] loss=5.8390
05-Feb-26 06:34:27 - [Epoch=1 | Step=91600/334762] loss=5.2064
05-Feb-26 06:35:18 - [Epoch=1 | Step=91700/334762] loss=5.5553
05-Feb-26 06:36:08 - [Epoch=1 | Step=91800/334762] loss=6.1536
05-Feb-26 06:36:58 - [Epoch=1 | Step=91900/334762] loss=4.9607
05-Feb-26 06:37:49 - [Epoch=1 | Step=92000/334762] loss=4.9165
05-Feb-26 06:38:39 - [Epoch=1 | Step=92100/334762] loss=5.5467
05-Feb-26 06:39:29 - [Epoch=1 | Step=92200/334762] loss=4.3519
05-Feb-26 06:40:19 - [Epoch=1 | Step=92300/334762] loss=6.0517
05-Feb-26 06:41:10 - [Epoch=1 | Step=92400/334762] loss=6.9108
05-Feb-26 06:42:00 - [Epoch=1 | Step=92500/334762] loss=5.7823
05-Feb-26 06:42:51 - [Epoch=1 | Step=92600/334762] loss=7.5519
05-Feb-26 06:43:40 - [Epoch=1 | Step=92700/334762] loss=5.8881
05-Feb-26 06:44:30 - [Epoch=1 | Step=92800/334762] loss=5.2996
05-Feb-26 06:45:20 - [Epoch=1 | Step=92900/334762] loss=5.1879
05-Feb-26 06:46:10 - [Epoch=1 | Step=93000/334762] loss=5.3464
05-Feb-26 06:47:00 - [Epoch=1 | Step=93100/334762] loss=4.4659
05-Feb-26 06:47:50 - [Epoch=1 | Step=93200/334762] loss=4.5425
05-Feb-26 06:48:40 - [Epoch=1 | Step=93300/334762] loss=5.1767
05-Feb-26 06:49:30 - [Epoch=1 | Step=93400/334762] loss=5.7967
05-Feb-26 06:50:21 - [Epoch=1 | Step=93500/334762] loss=6.1994
05-Feb-26 06:51:12 - [Epoch=1 | Step=93600/334762] loss=7.0472
05-Feb-26 06:52:02 - [Epoch=1 | Step=93700/334762] loss=7.2512
05-Feb-26 06:52:52 - [Epoch=1 | Step=93800/334762] loss=4.2720
05-Feb-26 06:53:41 - [Epoch=1 | Step=93900/334762] loss=4.7838
05-Feb-26 06:54:30 - [Epoch=1 | Step=94000/334762] loss=4.3292
05-Feb-26 06:55:20 - [Epoch=1 | Step=94100/334762] loss=5.5436
05-Feb-26 06:56:08 - [Epoch=1 | Step=94200/334762] loss=4.2239
05-Feb-26 06:56:56 - [Epoch=1 | Step=94300/334762] loss=4.7350
05-Feb-26 06:57:45 - [Epoch=1 | Step=94400/334762] loss=4.0482
05-Feb-26 06:58:34 - [Epoch=1 | Step=94500/334762] loss=5.4954
05-Feb-26 06:59:22 - [Epoch=1 | Step=94600/334762] loss=5.7053
05-Feb-26 07:00:10 - [Epoch=1 | Step=94700/334762] loss=5.9333
05-Feb-26 07:00:58 - [Epoch=1 | Step=94800/334762] loss=9.5030
05-Feb-26 07:01:45 - [Epoch=1 | Step=94900/334762] loss=10.5906
05-Feb-26 07:02:33 - [Epoch=1 | Step=95000/334762] loss=8.1017
05-Feb-26 07:03:21 - [Epoch=1 | Step=95100/334762] loss=6.8776
05-Feb-26 07:04:09 - [Epoch=1 | Step=95200/334762] loss=6.2768
05-Feb-26 07:04:56 - [Epoch=1 | Step=95300/334762] loss=4.5709
05-Feb-26 07:05:44 - [Epoch=1 | Step=95400/334762] loss=4.9211
05-Feb-26 07:06:31 - [Epoch=1 | Step=95500/334762] loss=5.6285
05-Feb-26 07:07:19 - [Epoch=1 | Step=95600/334762] loss=5.7169
05-Feb-26 07:08:06 - [Epoch=1 | Step=95700/334762] loss=4.3661
05-Feb-26 07:08:53 - [Epoch=1 | Step=95800/334762] loss=6.2079
05-Feb-26 07:09:41 - [Epoch=1 | Step=95900/334762] loss=4.9155
05-Feb-26 07:10:28 - [Epoch=1 | Step=96000/334762] loss=4.2931
05-Feb-26 07:11:15 - [Epoch=1 | Step=96100/334762] loss=5.1236
05-Feb-26 07:12:02 - [Epoch=1 | Step=96200/334762] loss=4.5978
05-Feb-26 07:12:50 - [Epoch=1 | Step=96300/334762] loss=5.4915
05-Feb-26 07:13:36 - [Epoch=1 | Step=96400/334762] loss=4.5301
05-Feb-26 07:14:23 - [Epoch=1 | Step=96500/334762] loss=4.7746
05-Feb-26 07:15:10 - [Epoch=1 | Step=96600/334762] loss=4.0283
05-Feb-26 07:15:57 - [Epoch=1 | Step=96700/334762] loss=5.5604
05-Feb-26 07:16:44 - [Epoch=1 | Step=96800/334762] loss=4.8653
05-Feb-26 07:17:32 - [Epoch=1 | Step=96900/334762] loss=5.1339
05-Feb-26 07:18:19 - [Epoch=1 | Step=97000/334762] loss=5.3366
05-Feb-26 07:19:07 - [Epoch=1 | Step=97100/334762] loss=6.9070
05-Feb-26 07:19:56 - [Epoch=1 | Step=97200/334762] loss=4.8585
05-Feb-26 07:20:43 - [Epoch=1 | Step=97300/334762] loss=4.9023
05-Feb-26 07:21:31 - [Epoch=1 | Step=97400/334762] loss=4.6509
05-Feb-26 07:22:19 - [Epoch=1 | Step=97500/334762] loss=4.9624
05-Feb-26 07:23:07 - [Epoch=1 | Step=97600/334762] loss=4.2343
05-Feb-26 07:23:55 - [Epoch=1 | Step=97700/334762] loss=3.8490
05-Feb-26 07:24:42 - [Epoch=1 | Step=97800/334762] loss=4.9974
05-Feb-26 07:25:31 - [Epoch=1 | Step=97900/334762] loss=3.7178
05-Feb-26 07:26:19 - [Epoch=1 | Step=98000/334762] loss=4.9923
05-Feb-26 07:27:07 - [Epoch=1 | Step=98100/334762] loss=6.0055
05-Feb-26 07:27:55 - [Epoch=1 | Step=98200/334762] loss=6.2871
05-Feb-26 07:28:43 - [Epoch=1 | Step=98300/334762] loss=5.9333
05-Feb-26 07:29:31 - [Epoch=1 | Step=98400/334762] loss=5.4855
05-Feb-26 07:30:19 - [Epoch=1 | Step=98500/334762] loss=5.8889
05-Feb-26 07:31:07 - [Epoch=1 | Step=98600/334762] loss=5.8759
05-Feb-26 07:31:55 - [Epoch=1 | Step=98700/334762] loss=3.9389
05-Feb-26 07:32:42 - [Epoch=1 | Step=98800/334762] loss=5.7401
05-Feb-26 07:33:30 - [Epoch=1 | Step=98900/334762] loss=5.9891
05-Feb-26 07:34:17 - [Epoch=1 | Step=99000/334762] loss=5.8179
05-Feb-26 07:35:05 - [Epoch=1 | Step=99100/334762] loss=6.1902
05-Feb-26 07:35:53 - [Epoch=1 | Step=99200/334762] loss=5.8863
05-Feb-26 07:36:41 - [Epoch=1 | Step=99300/334762] loss=5.8070
05-Feb-26 07:37:29 - [Epoch=1 | Step=99400/334762] loss=4.9694
05-Feb-26 07:38:17 - [Epoch=1 | Step=99500/334762] loss=4.9572
05-Feb-26 07:39:05 - [Epoch=1 | Step=99600/334762] loss=4.1336
05-Feb-26 07:39:53 - [Epoch=1 | Step=99700/334762] loss=4.4412
05-Feb-26 07:40:41 - [Epoch=1 | Step=99800/334762] loss=4.2686
05-Feb-26 07:41:29 - [Epoch=1 | Step=99900/334762] loss=4.4649
05-Feb-26 07:42:18 - [Epoch=1 | Step=100000/334762] loss=3.5728
05-Feb-26 07:43:05 - [Epoch=1 | Step=100100/334762] loss=4.8914
05-Feb-26 07:43:53 - [Epoch=1 | Step=100200/334762] loss=4.2422
05-Feb-26 07:44:41 - [Epoch=1 | Step=100300/334762] loss=4.8094
05-Feb-26 07:45:28 - [Epoch=1 | Step=100400/334762] loss=6.0212
05-Feb-26 07:46:16 - [Epoch=1 | Step=100500/334762] loss=5.7889
05-Feb-26 07:47:03 - [Epoch=1 | Step=100600/334762] loss=5.7957
05-Feb-26 07:47:50 - [Epoch=1 | Step=100700/334762] loss=4.8615
05-Feb-26 07:48:38 - [Epoch=1 | Step=100800/334762] loss=5.6577
05-Feb-26 07:49:25 - [Epoch=1 | Step=100900/334762] loss=4.8619
05-Feb-26 07:50:12 - [Epoch=1 | Step=101000/334762] loss=4.7446
05-Feb-26 07:50:59 - [Epoch=1 | Step=101100/334762] loss=4.5759
05-Feb-26 07:51:46 - [Epoch=1 | Step=101200/334762] loss=4.5555
05-Feb-26 07:52:34 - [Epoch=1 | Step=101300/334762] loss=5.2964
05-Feb-26 07:53:21 - [Epoch=1 | Step=101400/334762] loss=4.4987
05-Feb-26 07:54:09 - [Epoch=1 | Step=101500/334762] loss=4.6637
05-Feb-26 07:54:56 - [Epoch=1 | Step=101600/334762] loss=6.2607
05-Feb-26 07:55:44 - [Epoch=1 | Step=101700/334762] loss=4.1328
05-Feb-26 07:56:32 - [Epoch=1 | Step=101800/334762] loss=5.1609
05-Feb-26 07:57:20 - [Epoch=1 | Step=101900/334762] loss=4.6763
05-Feb-26 07:58:08 - [Epoch=1 | Step=102000/334762] loss=5.3577
05-Feb-26 07:58:55 - [Epoch=1 | Step=102100/334762] loss=5.0399
05-Feb-26 07:59:42 - [Epoch=1 | Step=102200/334762] loss=5.9612
05-Feb-26 08:00:30 - [Epoch=1 | Step=102300/334762] loss=5.4472
05-Feb-26 08:01:18 - [Epoch=1 | Step=102400/334762] loss=4.7685
05-Feb-26 08:02:06 - [Epoch=1 | Step=102500/334762] loss=5.4340
05-Feb-26 08:02:54 - [Epoch=1 | Step=102600/334762] loss=4.9945
05-Feb-26 08:03:41 - [Epoch=1 | Step=102700/334762] loss=4.4532
05-Feb-26 08:04:29 - [Epoch=1 | Step=102800/334762] loss=5.8247
05-Feb-26 08:05:16 - [Epoch=1 | Step=102900/334762] loss=4.2285
05-Feb-26 08:06:04 - [Epoch=1 | Step=103000/334762] loss=5.1777
05-Feb-26 08:06:52 - [Epoch=1 | Step=103100/334762] loss=5.3461
05-Feb-26 08:07:40 - [Epoch=1 | Step=103200/334762] loss=4.3941
05-Feb-26 08:08:28 - [Epoch=1 | Step=103300/334762] loss=4.9757
05-Feb-26 08:09:15 - [Epoch=1 | Step=103400/334762] loss=3.3408
05-Feb-26 08:10:03 - [Epoch=1 | Step=103500/334762] loss=3.5893
05-Feb-26 08:10:50 - [Epoch=1 | Step=103600/334762] loss=3.4865
05-Feb-26 08:11:37 - [Epoch=1 | Step=103700/334762] loss=4.2363
05-Feb-26 08:12:25 - [Epoch=1 | Step=103800/334762] loss=5.1912
05-Feb-26 08:13:13 - [Epoch=1 | Step=103900/334762] loss=4.0439
05-Feb-26 08:14:00 - [Epoch=1 | Step=104000/334762] loss=5.9955
05-Feb-26 08:14:48 - [Epoch=1 | Step=104100/334762] loss=4.5874
05-Feb-26 08:15:36 - [Epoch=1 | Step=104200/334762] loss=4.5675
05-Feb-26 08:16:23 - [Epoch=1 | Step=104300/334762] loss=5.0354
05-Feb-26 08:17:11 - [Epoch=1 | Step=104400/334762] loss=4.2395
05-Feb-26 08:17:59 - [Epoch=1 | Step=104500/334762] loss=4.1498
05-Feb-26 08:18:46 - [Epoch=1 | Step=104600/334762] loss=5.4495
05-Feb-26 08:19:34 - [Epoch=1 | Step=104700/334762] loss=4.8587
05-Feb-26 08:20:22 - [Epoch=1 | Step=104800/334762] loss=4.6828
05-Feb-26 08:21:10 - [Epoch=1 | Step=104900/334762] loss=4.7956
05-Feb-26 08:21:58 - [Epoch=1 | Step=105000/334762] loss=5.7357
05-Feb-26 08:22:46 - [Epoch=1 | Step=105100/334762] loss=4.7766
05-Feb-26 08:23:35 - [Epoch=1 | Step=105200/334762] loss=5.0118
05-Feb-26 08:24:23 - [Epoch=1 | Step=105300/334762] loss=7.3859
05-Feb-26 08:25:12 - [Epoch=1 | Step=105400/334762] loss=6.1408
05-Feb-26 08:26:01 - [Epoch=1 | Step=105500/334762] loss=7.1111
05-Feb-26 08:26:51 - [Epoch=1 | Step=105600/334762] loss=4.7496
05-Feb-26 08:27:39 - [Epoch=1 | Step=105700/334762] loss=4.1296
05-Feb-26 08:28:29 - [Epoch=1 | Step=105800/334762] loss=4.2637
05-Feb-26 08:29:18 - [Epoch=1 | Step=105900/334762] loss=4.6496
05-Feb-26 08:30:08 - [Epoch=1 | Step=106000/334762] loss=4.9947
05-Feb-26 08:30:58 - [Epoch=1 | Step=106100/334762] loss=3.9598
05-Feb-26 08:31:48 - [Epoch=1 | Step=106200/334762] loss=4.9633
05-Feb-26 08:32:38 - [Epoch=1 | Step=106300/334762] loss=5.4335
05-Feb-26 08:33:28 - [Epoch=1 | Step=106400/334762] loss=4.4605
05-Feb-26 08:34:18 - [Epoch=1 | Step=106500/334762] loss=5.0233
05-Feb-26 08:35:08 - [Epoch=1 | Step=106600/334762] loss=5.3681
05-Feb-26 08:35:58 - [Epoch=1 | Step=106700/334762] loss=5.7284
05-Feb-26 08:36:49 - [Epoch=1 | Step=106800/334762] loss=6.1814
05-Feb-26 08:37:39 - [Epoch=1 | Step=106900/334762] loss=5.4186
05-Feb-26 08:38:29 - [Epoch=1 | Step=107000/334762] loss=6.1699
05-Feb-26 08:39:19 - [Epoch=1 | Step=107100/334762] loss=4.0886
05-Feb-26 08:40:10 - [Epoch=1 | Step=107200/334762] loss=3.9070
05-Feb-26 08:41:00 - [Epoch=1 | Step=107300/334762] loss=6.4828
05-Feb-26 08:41:50 - [Epoch=1 | Step=107400/334762] loss=9.0960
05-Feb-26 08:42:42 - [Epoch=1 | Step=107500/334762] loss=5.9528
05-Feb-26 08:43:36 - [Epoch=1 | Step=107600/334762] loss=4.5325
05-Feb-26 08:44:31 - [Epoch=1 | Step=107700/334762] loss=5.5184
05-Feb-26 08:45:29 - [Epoch=1 | Step=107800/334762] loss=4.8119
05-Feb-26 08:46:19 - ---------Epoch 01 | Average Loss: 15.0701
05-Feb-26 09:43:20 - ---------Epoch 01 | Average Validation: 52.2138
05-Feb-26 09:43:20 - ---------Epoch 01 | Overestimation (>3dB): 29648
05-Feb-26 09:43:20 - ---------Epoch 01 | Underestimation (<-3dB): 1156331
05-Feb-26 09:43:20 - Model weights saved at ./weights/model_weights20260204165247.pth
05-Feb-26 09:43:20 - Training Over
05-Feb-26 09:43:20 - ============================================================
05-Feb-26 09:43:20 - BENCHMARKING - Computing metrics
05-Feb-26 09:43:20 - ============================================================
05-Feb-26 09:43:20 - Computing accuracy metrics on validation set...
05-Feb-26 10:44:08 - ----------------------------------------
05-Feb-26 10:44:08 - ACCURACY METRICS (on validation set)
05-Feb-26 10:44:08 - ----------------------------------------
05-Feb-26 10:44:08 -   Samples evaluated: 1340288
05-Feb-26 10:44:08 -   RMSE (dB):         62.02 dB
05-Feb-26 10:44:08 -   MAE (dB):          52.71 dB
05-Feb-26 10:44:08 -   Median error:      55.32 dB
05-Feb-26 10:44:08 -   90th percentile:   92.59 dB
05-Feb-26 10:44:08 -   95th percentile:   101.22 dB
05-Feb-26 10:44:08 - ----------------------------------------
05-Feb-26 10:44:08 - SPEED BENCHMARK
05-Feb-26 10:44:08 - ----------------------------------------
05-Feb-26 10:44:47 -   Batch size: 64
05-Feb-26 10:44:47 -   Runs: 100
05-Feb-26 10:44:47 -   Total time: 30.708 s
05-Feb-26 10:44:47 -   Time per batch: 307.08 ms
05-Feb-26 10:44:47 -   Time per sample: 4798.1 us
05-Feb-26 10:44:47 -   Throughput: 208 samples/second
05-Feb-26 10:44:47 - ============================================================
05-Feb-26 10:44:47 - SUMMARY
05-Feb-26 10:44:47 - ============================================================
05-Feb-26 10:44:47 -   Dataset: 4741 parquet files
05-Feb-26 10:44:47 -   Train/Val split: 3792/949
05-Feb-26 10:44:47 -   Model accuracy: RMSE = 62.02 dB, MAE = 52.71 dB
05-Feb-26 10:44:47 -   Inference speed: 208 predictions/second
05-Feb-26 10:44:47 -   Time per prediction: 4798.1 us
05-Feb-26 10:44:47 - ============================================================
05-Feb-26 10:44:47 - Benchmark results saved to ./logs/benchmark_20260204165247.json
